Nome EC,UF EC,Cidade EC,Logradouro EC,Desvio de Preço (%),Blacklist,Preço por Litro,Mercadoria
POSTO LM,CE,FORTALEZA,"Rua AV MTO LISBOA 1680, S/N","0,30%",✅ Dentro da média,6.236237456708997,Gasolina Comum
AUTO POSTO CALUNGA LTD,SP,SAO VICENTE,"Rua AV.  ANTONIO EMMERICK 1445,","0,29%",✅ Dentro da média,4.321924257264119,Etanol
POSTO ANEL VIARIO,CE,FORTALEZA,"Rua ROD QUARTO ANEL VIARIO 1700,","0,28%",✅ Dentro da média,6.2345514983131585,Gasolina Comum
L E S COMERCIO DE COMBUSTIVEIS,CE,MARACANAU,Rua ROD. DR MENDEL STEINBRUCH 99,"0,26%",✅ Dentro da média,6.233389342832946,Gasolina Comum
AUTO POSTO DIAMANTE,MG,COROMANDEL,"Rua AV DR HUMBERTO MACHADO 50, S","0,25%",✅ Dentro da média,4.32,Etanol
POSTO ABN,CE,FORTALEZA,"Rua AV CESAR CALS 97, S/N","0,23%",✅ Dentro da média,6.2317819143265325,Gasolina Comum
MARAJO ELDORADO DOS CA,PA,ELDORADO DOS CARAJAS,"Área ROD BR 155 S N, S/N","0,21%",✅ Dentro da média,5.89,Diesel S10
POSTO 3D JAMAPARA,RJ,JAMAPARA,"Rua AV  COTRIL, S/N","0,21%",✅ Dentro da média,5.89,Diesel S10
POSTO IGUANA,RN,MOSSORO,"Rua AV PRES DUTRA SN, S/N","0,21%",✅ Dentro da média,5.89,Diesel S10
POSTO KENNEDY,PI,AMARANTE,"Rua R REGENERACAO 1546, S/N","0,21%",✅ Dentro da média,5.89,Diesel S10
POSTO REGINA,MA,IMPERATRIZ,"Rua ROD BR-010  KL 1352   S/N, S","0,21%",✅ Dentro da média,5.89,Diesel S10
POSTO TABAPOA,CE,CAUCAIA,ROD BR 222,"0,21%",✅ Dentro da média,5.89,Diesel S10
POSTO UMARITUBA HORIZONTE,CE,HORIZONTE,Rua AV PRESID CASTELO BRANCO 867,"0,21%",✅ Dentro da média,5.89,Diesel S10
VAZ OLIVEIRA & CRUZ LTDA,PA,BENEVIDES,ROD BR 316 25,"0,21%",✅ Dentro da média,5.89,Diesel S10
POSTO DUAS COLUNAS,RJ,TRES RIOS,Rua AV. CONDESSA DE RIO NOVO 105,"0,21%",✅ Dentro da média,5.889999999999999,Diesel S10
POSTO KARIRI,CE,JUAZEIRO DO NORTE,"Rua AV.  CASTELO BRANCO,253, S/N","0,21%",✅ Dentro da média,5.889999999999999,Diesel S10
AUTO POSTO VILA NOVA,MG,CATAGUASES,"Rua FRANCISCO VALENTE, 22","0,20%",✅ Dentro da média,6.23,Gasolina Comum
POSTO CAMBEBA,CE,FORTALEZA,"Rua AV WASHINGTON SOARES 5501, S","0,20%",✅ Dentro da média,6.23,Gasolina Comum
UNIAO COMERCIO DE COMBUSTIVEL L,CE,FORTALEZA,"Rua AV BORGES DE MELO 1277, S/N","0,20%",✅ Dentro da média,6.23,Gasolina Comum
POSTO PRINCESA DOS LAGOS,MA,VIANA,Área AVENIDA JORGE ABRAAO DUAILI,"0,20%",✅ Dentro da média,6.2298082869511475,Gasolina Comum
CARREFOUR ESV,SP,SAO PAULO,"Rua AV CARLOS LINDENBERG 4393, S","0,14%",✅ Dentro da média,6.226289392774788,Gasolina Comum
BULL PETROLEO,MG,ARAXA,"Rua AV WILSON BORGES 605, S/N","0,10%",✅ Dentro da média,5.95,Diesel
LUA PETROLEO-SHELL,CE,EUSEBIO,ROD CE 40 6,"0,10%",✅ Dentro da média,5.95,Diesel
POSTO TREVO 13,AL,SAO SEBASTIAO,"Rua ROD BR 101 SUL, KM 206 S/N,","0,04%",✅ Dentro da média,5.88,Diesel S10
POSTO MANIA,CE,FORTALEZA,"Rua R. JOSE TORRES N 200, S/N","0,04%",✅ Dentro da média,6.219783174727529,Gasolina Comum
POSTO STATUS,RJ,GUAPIMIRIM,"Rua EST RIO TERESOPOLIS KM 107,","-0,07%",✅ Dentro da média,5.94,Diesel
POSTO FULL,MA,PRESIDENTE DUTRA,"Área AV OTON GONCALVES DE SA, 85","-0,12%",✅ Dentro da média,6.2098066690742755,Gasolina Comum
POSTO SUL-SHELL,CE,FORTALEZA,"Rua ROD.  BR-116 KM 07 N 2620, S","-0,13%",✅ Dentro da média,5.870000000000001,Diesel S10
POSTO AEROPORTO,ES,VITORIA,Rua AVENIDA ADALBERTO SIMAO NADE,"-0,14%",✅ Dentro da média,6.208599119225947,Gasolina Comum
JACARE AUTO POSTO LTDA,MG,SAO SEBASTIAO DO PARAISO,"Rua AV OLIVEIRA REZENDE 1016, S/","-0,16%",✅ Dentro da média,4.3025370370370375,Etanol
POSTO CACIQUE 40,MA,TIMON,Área AV.  FRANCISCO CARLOS JANS,"-0,19%",✅ Dentro da média,6.205768231699642,Gasolina Comum
POSTO METANO,RJ,BARRA MANSA,"Rua ROD.PRES DUTRA KM 269, S/N","-0,19%",✅ Dentro da média,6.205285213217649,Gasolina Comum
AMCE FRONTEIRAS LTDA,RN,NATAL,"Área AVENIDA DAO SILVEIRA, 8000,","-0,22%",✅ Dentro da média,6.203841201716738,Gasolina Comum
POSTO MARANHAO,MA,SANTA INES,"Rua R DAS CAJAZEIRAS, S/N","-0,25%",✅ Dentro da média,6.201652291469512,Gasolina Comum
GIPIRES POSTO DE SERVICO LTDA,SP,SAO PAULO,"Rua AV.  CASA VERDE 2971, S/N","-0,26%",✅ Dentro da média,4.298206670007238,Etanol
POSTO SANTA MARIA,MA,IMPERATRIZ,"Praça LINO TEIXEIRA, 306","-0,27%",✅ Dentro da média,6.200276868772291,Gasolina Comum
POSTO MAIS PAIZAO BELA VISTA,MA,BELA VISTA DO MARANHAO,"ROD BR 316, 01","-0,28%",✅ Dentro da média,6.2,Gasolina Comum
POSTO CENTER,MA,SANTA INES,"Rua R DA PEDRA BRANCA 619, S/N","-0,34%",✅ Dentro da média,6.196062896006511,Gasolina Comum
EURO GAS,DF,BRASILIA,"Rua QS 9 R 123 L 06 / 14, S/N","-0,36%",✅ Dentro da média,6.194687001594897,Gasolina Comum
POSTO NATUREZA TURU,MA,SAO LUIS,Rua AV. S LUIS REI DE FRANCA 190,"-0,39%",✅ Dentro da média,6.193331957060281,Gasolina Comum
AUTO POSTO GONZAGAO,MA,IMPERATRIZ,"Praça LINO TEIXEIRA, 306","-0,39%",✅ Dentro da média,6.1931038384541734,Gasolina Comum
POSTO BRAGA,CE,MOMBACA,"Rua R JOSE DE SA AZEVEDO, 99, S/","-0,44%",✅ Dentro da média,6.190259685931267,Gasolina Comum
POSTO SAO CRISTOVAO-SHELL,MA,SANTA LUZIA,"Rua ROD BR 222 KM 49, S/N","-0,44%",✅ Dentro da média,6.190225068837544,Gasolina Comum
ALESAT POSTO ZAMBELI,RJ,BARRA DO PIRAI,"Rua R JOSE ALVES PIMENTA 1616, S","-0,44%",✅ Dentro da média,6.19,Gasolina Comum
AUTO POSTO DGF LAGOS LTDA,RJ,SAO PEDRO DA ALDEIA,"Rua ROD AMARAL PEIXOTO KM 110, S","-0,44%",✅ Dentro da média,6.19,Gasolina Comum
KLL POSTO DE ABAST E-SHELL,SP,MAUA,"Rua AV. PAPA JOAO XXIII 2009, S/","-0,44%",✅ Dentro da média,6.19,Gasolina Comum
POSTO CAMPEAO,PE,PAUDALHO,"Rodovia BR 408/3, S/N","-0,44%",✅ Dentro da média,6.19,Gasolina Comum
POSTO KENNEDY,PI,AMARANTE,"Rua R REGENERACAO 1546, S/N","-0,44%",✅ Dentro da média,6.19,Gasolina Comum
POSTO MARAVILHA,CE,RUSSAS,"Avenida IRMA MARIA DA GRACA, 104","-0,44%",✅ Dentro da média,6.19,Gasolina Comum
POSTO NATUREZA ARACAGY,MA,SAO JOSE DE RIBAMAR,"Área ESTRADA RAPOSA  01 06 SN, S","-0,44%",✅ Dentro da média,6.19,Gasolina Comum
POSTO NATUREZA HOLANDESES,MA,SAO LUIS,"Área AV DOS HOLANDESES,19, S/N","-0,44%",✅ Dentro da média,6.19,Gasolina Comum
POSTO NATUREZA TIBIRI,MA,SAO LUIS,"Área AV.  EMILIANO MACIEIRA,13,","-0,44%",✅ Dentro da média,6.19,Gasolina Comum
POSTO SANTA LUZIA,CE,RUSSAS,RUA RAIMUNDO ALVES 2205,"-0,44%",✅ Dentro da média,6.19,Gasolina Comum
RVM DO SUDOESTE -ESSO,MG,PASSOS,Rua AV. CDOR FRANCISCO A MAIA 43,"-0,44%",✅ Dentro da média,6.19,Gasolina Comum
VERTICE AUTO POSTO,RJ,SAMPAIO CORREIA,"Rua R PROF SOUSA 777, S/N","-0,44%",✅ Dentro da média,6.19,Gasolina Comum
AUTO POSTO GUARANI,SP,SAO VICENTE,"Rua GUARANI, 11","-0,44%",✅ Dentro da média,6.1899999999999995,Gasolina Comum
P.CACIQUE 07,PI,TERESINA,"Rua AV. DQ CAXIAS 2448, S/N","-0,44%",✅ Dentro da média,6.1899999999999995,Gasolina Comum
POSTO MONTE CRISTO LTDA,RJ,BARRA MANSA,Rua ROD PRESIDENTE DUTRA KM 271,"-0,44%",✅ Dentro da média,6.1899999999999995,Gasolina Comum
POSTO STATUS,RJ,GUAPIMIRIM,"Rua EST RIO TERESOPOLIS KM 107,","-0,44%",✅ Dentro da média,6.189999999999999,Gasolina Comum
A P ANTONIO EMERICK,SP,SAO VICENTE,"Rua AV. ANTONIO EMMERICK 46, S/N","-0,45%",✅ Dentro da média,4.290000000000001,Etanol
AUTO POSTO 7 PASSOS,SP,PERUIBE,"Rua AV JOAO ABEL 1276, S/N","-0,45%",✅ Dentro da média,4.29,Etanol
AUTO POSTO COLORADO,SP,SERRANA,"Rua RUA RUA RIO DE JANEIRO 2000,","-0,45%",✅ Dentro da média,4.29,Etanol
AUTO POSTO KAJIYA,SP,SAO SEBASTIAO,"Rua AVENIDA GDA-MOR LOBO VIANA,","-0,45%",✅ Dentro da média,4.29,Etanol
AUTO POSTO LINHA UM,SP,SANTOS,"Rua AV NS DE FATIMA 635, S/N","-0,45%",✅ Dentro da média,4.29,Etanol
AUTO POSTO METROP,SP,SAO PAULO,"Rua AV. RAGUEB CHOHFI 810, S/N","-0,45%",✅ Dentro da média,4.29,Etanol
AUTO POSTO MONACO,MG,UBERLANDIA,"Avenida SEGISMUNDO PEREIRA, 2872","-0,45%",✅ Dentro da média,4.29,Etanol
AUTO POSTO N S J DA BARRA,SP,SAO JOAQUIM DA BARRA,AV GOV ORESTES QUERCIA 2863,"-0,45%",✅ Dentro da média,4.29,Etanol
AUTO POSTO PRA FRENTE,PR,ARAPONGAS,"Rua ROD BR 369 KM 181,2 SAIDA, S","-0,45%",✅ Dentro da média,4.29,Etanol
AUTO POSTO PRESIDENTE COSTA 2 LT,SP,PRAIA GRANDE,"Área AVENIDA COSTA E SILVA, 1088","-0,45%",✅ Dentro da média,4.29,Etanol
AUTO POSTO RNM,SP,JACAREI,"Rua ROD.  NILO MAXIMO  KM 4, S/N","-0,45%",✅ Dentro da média,4.29,Etanol
CENTRO AUTOMOTIVO AGUA FRIA LTD,SP,SAO PAULO,"Rua AV AGUA FRIA 779, S/N","-0,45%",✅ Dentro da média,4.29,Etanol
CENTRO AUTOMOTIVO GUARUMON,SP,SAO PAULO,Área AV OCTAVIO B DE MESQUITA SN,"-0,45%",✅ Dentro da média,4.29,Etanol
POSTO CONTIN,SP,SAO JOAQUIM DA BARRA,"Rua RUA PARAIBA 775, S/N","-0,45%",✅ Dentro da média,4.29,Etanol
POSTO CPA,PR,MARIALVA,"Rua ROD BR 376, S/N","-0,45%",✅ Dentro da média,4.29,Etanol
POSTO MALBEC,SP,SAO CAETANO DO SUL,"Rua R. S PAULO, 650, S/N","-0,45%",✅ Dentro da média,4.29,Etanol
POSTO V BRAMBILA II,PR,APUCARANA,"Rua AV.  MINAS GERAIS 568, S/N","-0,45%",✅ Dentro da média,4.29,Etanol
TREVIZO A.POSTO-SHELL,SP,GUARULHOS,Rua RUA BELA VISTA DO PARAISO 15,"-0,45%",✅ Dentro da média,4.29,Etanol
AUTO POSTO PIRES,PR,FAXINAL,"Rua RUA SANTOS DUMONT, 320, S/N","-0,45%",✅ Dentro da média,4.289999999999999,Etanol
POSTO TRIANGULO,MG,UBERLANDIA,Rua AV.  JOAO NAVES DE AVILA 455,"-0,45%",✅ Dentro da média,4.289999999999999,Etanol
POSTO CLEMENTINO,PI,LAGOINHA DO PIAUI,Rodovia ROD BR ESQUINA COM BR PO,"-0,47%",✅ Dentro da média,5.85,Diesel S10
P.CACIQUE 09,PI,TERESINA,"Rua R.  OLAVO BILAC 989, S/N","-0,51%",✅ Dentro da média,6.185358690418873,Gasolina Comum
AUTO POSTO ITARARE,SP,SAO VICENTE,"Rua AV MARTINS FONTES 1572, S/N","-0,56%",✅ Dentro da média,4.285159827703469,Etanol
POSTO PISTAO SUL,DF,BRASILIA,"Rua QS 09 RUA 123 LOTE 24 E 26,","-0,60%",✅ Dentro da média,6.180224324736762,Gasolina Comum
ALESAT POSTO PESSERGUEIROS,RJ,TERESOPOLIS,"Rua ESTRADA RIO BAHIA KM 66, S/N","-0,60%",✅ Dentro da média,6.18,Gasolina Comum
ALO COMBUSTIVEIS,PI,PICOS,"AVENIDA SEN HELVIDIO NUNES, 3545","-0,60%",✅ Dentro da média,6.18,Gasolina Comum
MASTERGAS,PB,JOAO PESSOA,Rua AV PRES EPITACIO PESSOA 3313,"-0,60%",✅ Dentro da média,6.18,Gasolina Comum
FWC FILHO COMBUSTIVEIS,CE,ACOPIARA,"Área ROD 371 SN, S/N","-0,64%",✅ Dentro da média,5.84,Diesel S10
POSTO JAMANTA,RJ,SAPUCAIA,"Rua ROD BR 116 KM 72, S/N","-0,65%",✅ Dentro da média,5.839206988165204,Diesel S10
ROMA PNEUS E RECAPAGENS,MA,SAO LUIS,Rua AV.ENG EMILIANO MACIEIRA 55,"-0,65%",✅ Dentro da média,5.839040247678018,Diesel S10
FC AUTO POSTO,MG,SAO SEBASTIAO DO PARAISO,Avenida ENGENHEIRO WASHINGTON MA,"-0,68%",✅ Dentro da média,4.28,Etanol
FCQ AUTO POSTO,MG,SAO SEBASTIAO DO PARAISO,"Avenida OLIVEIRA RESENDE, 691","-0,68%",✅ Dentro da média,4.28,Etanol
POSTO HELLENA,MA,SANTA INES,"Rua RUA DO SOL, S/N","-0,69%",✅ Dentro da média,6.174479393869819,Gasolina Comum
AUTO POSTO VEREDA,SP,GUARUJA,AVENIDA PUGLISI 430,"-0,70%",✅ Dentro da média,4.279229466553767,Etanol
POSTO MAGNOLIA POSTO MGNO,MA,SANTA INES,"Rua BR 316 KM 261 S/N, S/N","-0,75%",✅ Dentro da média,6.170955203308064,Gasolina Comum
POSTO MINAS GERAIS,MA,ESTREITO,"Rua BR 10 KM 1226, S/N","-0,81%",✅ Dentro da média,6.167252344507923,Gasolina Comum
POSTO MAIS BOA ESPERANCA,MA,TIMON,"Rua BR316 6563, S/N","-0,82%",✅ Dentro da média,3.8,Arla 32
O PIONEIRO,CE,MISSAO VELHA,"Rua CORONEL JOSE DANTAS, 1580","-0,84%",✅ Dentro da média,6.165073333333334,Gasolina Comum
POSTO SUL-SHELL,CE,FORTALEZA,"Rua ROD.  BR-116 KM 07 N 2620, S","-0,91%",✅ Dentro da média,5.89,Diesel
POSTO MAGNOLIA POSTO M,MA,SANTA INES,ROD BR 222 KM 04,"-0,92%",✅ Dentro da média,6.160000000000001,Gasolina Comum
POSTOS AGAPE LTDA,MA,SANTA INES,"Área AREA RURAL, S/N","-0,92%",✅ Dentro da média,6.159999999999999,Gasolina Comum
APIGUANA,CE,FORTALEZA,"Avenida DUQUE DE CAXIAS, 959","-0,96%",✅ Dentro da média,6.157757510729613,Gasolina Comum
CARREFOUR PSR,ES,SERRA,Rua ROD.GOV M COVAS KM266.56 N60,"-0,98%",✅ Dentro da média,6.156249674789699,Gasolina Comum
AUTO POSTO VIADUTO PA-SHELL,SP,RIBEIRAO PIRES,"Rua R HUMBERTO DE CAMPOS 1100, S","-1,01%",✅ Dentro da média,4.265736648250461,Etanol
POSTO TAVARES,CE,SAO GONCALO DO AMARANTE,"Rua ROD BR 222 KM 63, S/N","-1,08%",✅ Dentro da média,6.150355312606765,Gasolina Comum
INVESTGAS,PB,ALHANDRA,"Rodovia BR 101/3, S/N","-1,08%",✅ Dentro da média,6.150000000000001,Gasolina Comum
POSTO ATUAL,PE,SANTA CRUZ DO CAPIBARIBE,Rua R MANOEL MONTEIRO DA PAIXAO,"-1,08%",✅ Dentro da média,6.15,Gasolina Comum
POSTO CACIQUE 22,PI,TERESINA,"Área AVENIDA UNIVERSITARIA, 880,","-1,08%",✅ Dentro da média,6.15,Gasolina Comum
POSTO P R O G R E S S O,PI,PASSAGEM FRANCA DO PIAUI,"Rua AV COSTA E SILVA SN, S/N","-1,08%",✅ Dentro da média,6.15,Gasolina Comum
POSTO VILLANOVA,PI,VILA NOVA DO PIAUI,"Rua ROD BR 316 KM 64, S/N","-1,08%",✅ Dentro da média,6.15,Gasolina Comum
POSTO TRIANGULO,CE,MAURITI,"Rua AV BURITI GRANDE 1200, S/N","-1,24%",✅ Dentro da média,6.140483380986416,Gasolina Comum
POSTO NOSSA SENHORA DE LOURDES,CE,REDENCAO,"Rua R FRANCISCO SILVA SN, S/N","-1,24%",✅ Dentro da média,6.14,Gasolina Comum
POSTO PICHILAU,PB,JOAO PESSOA,"Rodovia LOC ESTRADA BR 101, NA","-1,24%",✅ Dentro da média,6.139999999999999,Gasolina Comum
ROMA PNEUS E RECAPAGENS,MA,SAO LUIS,Rua AV.ENG EMILIANO MACIEIRA 55,"-1,25%",✅ Dentro da média,5.87,Diesel
POSTO NATUREZA CALHAU,MA,SAO LUIS,"Rua AVENIDA  FRANCESES, S/N","-1,32%",✅ Dentro da média,6.13554311774461,Gasolina Comum
NARCISO AUTOPOSTO,ES,VILA VELHA,"Rua R SOBREIRO 395, S/N","-1,34%",✅ Dentro da média,6.133755053256934,Gasolina Comum
POSTO NATUREZA TURU II,MA,SAO LUIS,Área AV SAO LUIS REI DE FRANCA48,"-1,35%",✅ Dentro da média,6.133703562583349,Gasolina Comum
AUTO POSTO DESPORTIVO,SP,SAO PAULO,"Rua AV MAL TITO 2400, S/N","-1,43%",✅ Dentro da média,4.247556818181819,Etanol
POSTO ABAIARA,CE,ABAIARA,"Rodovia CE 293/3, S/N","-1,49%",✅ Dentro da média,5.790000000000001,Diesel S10
POSTO OLD CAR PARA-SHELL,CE,FORTALEZA,"Rua RUA CARAPINIMA 2250, S/N","-1,49%",✅ Dentro da média,5.79,Diesel S10
VILA BELA COMERCIO DE,PE,JABOATAO DOS GUARARAPES,"Rodovia ROD BR232, NA","-1,49%",✅ Dentro da média,5.79,Diesel S10
POSTO QUATRO RODAS PA-SHELL,CE,FORTALEZA,"Rua AV.  JOVITA FEITOSA 1195, S/","-1,49%",✅ Dentro da média,5.789999999999999,Diesel S10
POSTO NAT ANJO GUARDA,MA,SAO LUIS,"Rua AV.  PORTUGUESES 135, S/N","-1,49%",✅ Dentro da média,6.124779154750556,Gasolina Comum
CARREFOUR PIM,MA,IMPERATRIZ,"Rua ROD.  BR-010 05 KM 1345 SN,","-1,57%",✅ Dentro da média,6.12,Gasolina Comum
RICALL CONBUSTIVEIS,BA,PAULO AFONSO,"Rua RODOVIA  BA-210, S/N","-1,57%",✅ Dentro da média,6.12,Gasolina Comum
CARRETEIRO 07,MA,ESTREITO,"Rua ROD BR010 KM 1225, S/N","-1,58%",✅ Dentro da média,6.119062103929024,Gasolina Comum
POSTO UMARITUBA,CE,SAO GONCALO DO AMARANTE,"Rua RODOVIA BR 222 KM 47, S/N","-1,59%",✅ Dentro da média,6.118280569612804,Gasolina Comum
AUTO POSTO BAIA DO SOL,SP,SAO SEBASTIAO,"Rua AV MANOEL TEIXEIRA 1000, S/N","-1,61%",✅ Dentro da média,4.24,Etanol
AUTO POSTO FLECHA III,SP,SAO SEBASTIAO,"Área AVENIDA VER ANTONIO BORGES,","-1,61%",✅ Dentro da média,4.24,Etanol
AUTO POSTO MORADA LTDA,MG,UBERABA,Rua AV MARIA DE SANTANA BORGES 1,"-1,61%",✅ Dentro da média,4.24,Etanol
AUTO POSTO TOPO VARADOURO,SP,SAO SEBASTIAO,"Área AVENIDA VER ANTONIO BORGES,","-1,61%",✅ Dentro da média,4.24,Etanol
JUSARA,SP,PATROCINIO PAULISTA,"Rua ROD RONAM ROCHA QL, S/N","-1,61%",✅ Dentro da média,4.24,Etanol
POSTO UAI,MG,MONTE CARMELO,"Rua AV OLEGARIO MACIEL 907, S/N","-1,61%",✅ Dentro da média,4.24,Etanol
JOSE LUIZ VICENTINI - ME,SP,IGARAPAVA,Rua AV JOAO AUGUSTO DE FREITAS 3,"-1,70%",✅ Dentro da média,4.236066594760098,Etanol
POSTO P DA SILVA,PI,PICOS,Rua AV. SENADOR HELVIDIO NUNES 2,"-1,70%",✅ Dentro da média,6.111676706827309,Gasolina Comum
ALESAT TRIBUS SERVICE,CE,CRATO,Rua AV PERIMETRAL DOM FRANCISCO,"-1,70%",✅ Dentro da média,6.111496305418719,Gasolina Comum
POSTO NATUREZA MAIOBAO,MA,PACO DO LUMIAR,"Rua ROD MA 201 KM 07 SN, S/N","-1,71%",✅ Dentro da média,6.111143586174901,Gasolina Comum
POSTO NACIONAL,MA,GRAJAU,"Rua BR 226 KM 414 S/N, S/N","-1,76%",✅ Dentro da média,6.107723742603549,Gasolina Comum
POSTO MAGNOLIA 11,MA,ZE DOCA,"Rua AV CORONEL ESTALE FORTI 668,","-1,83%",✅ Dentro da média,6.1035009823182715,Gasolina Comum
JUMEL COMERCIO DE COMBUSTIVEIS L,MA,PORTO FRANCO,"Rodovia BR 010/3, S/N","-1,89%",✅ Dentro da média,6.1,Gasolina Comum
POSTO CACIQUE 50,PI,FLORIANO,"Área ROD.BR 230 S N, S/N","-1,89%",✅ Dentro da média,6.1,Gasolina Comum
POSTO KAROLINA,MA,DOM PEDRO,"Rua BR 135 KM 306, S/N","-1,89%",✅ Dentro da média,6.1,Gasolina Comum
POSTO NATUREZA COHATRAC,MA,SAO LUIS,"Área AVENIDA V, QUAD 22, LOTE 1,","-1,95%",✅ Dentro da média,6.096370384290143,Gasolina Comum
POSTO SANTA INES,CE,MARACANAU,"Rua DR MENDEL STEINBRUCH, S/N","-2,03%",✅ Dentro da média,5.758103238043625,Diesel S10
POSTO QA,MA,ALTO ALEGRE DO MARANHAO,"Área KM 407, S/N","-2,04%",✅ Dentro da média,5.757672344188549,Diesel S10
AUTO POSTO FLEXEIRA,SP,CARAGUATATUBA,"Rua AV.  JOSE HERCULANO 7167, S/","-2,05%",✅ Dentro da média,6.090000000000001,Gasolina Comum
Auto Posto Rodovia Real Ltda,MG,LIMA DUARTE,"Área BR 267 KM 153, 0, S/N","-2,05%",✅ Dentro da média,6.090000000000001,Gasolina Comum
POSTO ABC,MG,SAO SEBASTIAO DO PARAISO,"Área ROD BR 491, 100 A, S/N","-2,05%",✅ Dentro da média,6.090000000000001,Gasolina Comum
POSTO CACIQUE 46,PI,TERESINA,R.PROF LIDIA CUNHA 2195,"-2,05%",✅ Dentro da média,6.090000000000001,Gasolina Comum
POSTO ESTRELA,CE,TRAIRI,"Rua AV MIGUEL PINTO FERREIRA 99,","-2,05%",✅ Dentro da média,6.090000000000001,Gasolina Comum
POSTO LAWANDA,MA,IMPERATRIZ,"Rua PEDRO NEIVA DE SANTANA, S/N","-2,05%",✅ Dentro da média,6.090000000000001,Gasolina Comum
POSTO UNIAO,RJ,SANTO ANTONIO DE PADUA,"Rua JOSE DE ALENCAR LEITE, 37","-2,05%",✅ Dentro da média,6.090000000000001,Gasolina Comum
A. SOARES BARRETO COMBUSTIVEIS,CE,PARAMBU,Rua AV SALUSTRINA HENRIQUE SILVA,"-2,05%",✅ Dentro da média,6.09,Gasolina Comum
AUTO POSTO GUIMARAES,MA,IMPERATRIZ,"Rua ROD.  BR-010 KM 1350, S/N","-2,05%",✅ Dentro da média,6.09,Gasolina Comum
POSTO BATATEIRAS,CE,CRATO,Rua AV JOAQUIM P BEZERRA MENEZES,"-2,05%",✅ Dentro da média,6.09,Gasolina Comum
POSTO CACIQUE 44,PI,TERESINA,AV :CAJUINA 1675 BAIRRO NOIVOS,"-2,05%",✅ Dentro da média,6.09,Gasolina Comum
POSTO DOM PEDRO RUSSAS,CE,RUSSAS,"Área ROD SANTOS DUMONT,157, S/N","-2,05%",✅ Dentro da média,6.09,Gasolina Comum
POSTO IGUABA GRANDE,RJ,IGUABA GRANDE,Rua ROD AMARAL PEIXOTO SN KM 95,"-2,05%",✅ Dentro da média,6.09,Gasolina Comum
POSTO NATUREZA MAIOBA,MA,SAO JOSE DE RIBAMAR,"Área EST DA MAIOBA MA, 202, S/N","-2,05%",✅ Dentro da média,6.09,Gasolina Comum
REDE RPB,SE,ESTANCIA,"AV. RUBENS ALVES DA SILVA, 1758","-2,05%",✅ Dentro da média,6.09,Gasolina Comum
AUTO POSTO SIENA,CE,CAMOCIM,"Rua ANTONIO ZEFERINO VERAS, 445","-2,05%",✅ Dentro da média,6.089999999999999,Gasolina Comum
POSTO RIBEIRAOZINHO-SHELL,MA,GOVERNADOR EDISON LOBAO,"Rua ROD BR 10 KM 1320, S/N","-2,05%",✅ Dentro da média,6.089999999999999,Gasolina Comum
POSTO CACIQUE 43,PI,TERESINA,Área AV: FREI SERAFIM 2500 CENTR,"-2,21%",✅ Dentro da média,6.0802545003103665,Gasolina Comum
POSTO NATUREZA RIO SAO JOAO,MA,SAO JOSE DE RIBAMAR,"Área EST DE RIBAMAR MA201, 2013,","-2,27%",✅ Dentro da média,6.076007712944333,Gasolina Comum
POSTO DE COMBUSTIVEIS SANTO ALEI,RJ,MAGE,Área OTHON LINCH BEZERRA DE MELL,"-2,29%",✅ Dentro da média,6.074800708591673,Gasolina Comum
POSTO NATUREZA MAIOBINHA,MA,SAO JOSE DE RIBAMAR,"Área ENT DA MATA 01, S/N","-2,33%",✅ Dentro da média,6.072647496281606,Gasolina Comum
ARCO IRIS ROSEIRA,SP,ROSEIRA,ROD PRESIDENTE DUTRA KM 82 0,"-2,34%",✅ Dentro da média,5.740000000000001,Diesel S10
POSTO QA,MA,ALTO ALEGRE DO MARANHAO,"Área KM 407, S/N","-2,43%",✅ Dentro da média,5.8,Diesel
POSTO NATUREZA COHAB,MA,SAO LUIS,Área AVENIDA JERONIMO DE ALBUQUE,"-2,43%",✅ Dentro da média,6.066375404530744,Gasolina Comum
POSTO IATE LTDA,ES,VITORIA,Rua AV.  SATURNINO DE BRITO 1394,"-2,49%",✅ Dentro da média,6.062363636363636,Gasolina Comum
POSTO 3D JAMAPARA,RJ,JAMAPARA,"Rua AV  COTRIL, S/N","-2,60%",✅ Dentro da média,5.79,Diesel
POSTO ABC,MG,SAO SEBASTIAO DO PARAISO,"Área ROD BR 491, 100 A, S/N","-2,66%",✅ Dentro da média,4.1945006632556385,Etanol
POSTO ABASTECA,PB,BAYEUX,Rua R FRANCISCO MARQUES FONSECA,"-2,66%",✅ Dentro da média,6.0517401743965635,Gasolina Comum
POSTO UNIVERSITARIO,RJ,VALENCA,"Rua R DA APARECIDA 593, S/N","-2,69%",✅ Dentro da média,6.05,Gasolina Comum
POSTO ABC,MG,SAO SEBASTIAO DO PARAISO,"Área AV ZEZE AMARAL, 335, S/N","-2,74%",✅ Dentro da média,4.191006909513017,Etanol
AUTO POSTO TROKAR,MS,CAMPO GRANDE,"Rua R JOSE ANTONIO PEREIRA 260,","-2,77%",✅ Dentro da média,4.190000000000001,Etanol
ITAJAO,MG,CARMO DO RIO CLARO,"Rua ROD MG 184 KM 6,5, S/N","-2,77%",✅ Dentro da média,4.190000000000001,Etanol
MACUCO AUTO POSTO,PR,CAMPO MOURAO,"Rua R. PION ALBERTO TANIGUT 34,","-2,77%",✅ Dentro da média,4.190000000000001,Etanol
POSTO JOAO PESSOA,MG,UBERLANDIA,"Rua AV.  JOAO PESSOA 875, S/N","-2,77%",✅ Dentro da média,4.190000000000001,Etanol
REDE FLOR CALMON,SP,POA,Rua AV. DR ADHEMAR DE BARROS 660,"-2,77%",✅ Dentro da média,4.190000000000001,Etanol
ALESAT AUTO POSTO PRAIA FLEIX,SP,CARAGUATATUBA,"Rua AV.  GASPAR DE SOUZA 450, S/","-2,77%",✅ Dentro da média,4.19,Etanol
AP FARIA LIMA,SP,SAO JOSE DOS CAMPOS,"Rua AV. BRG FARIA LIMA 899, S/N","-2,77%",✅ Dentro da média,4.19,Etanol
ARCO IRIS ROSEIRA,SP,ROSEIRA,ROD PRESIDENTE DUTRA KM 82 0,"-2,77%",✅ Dentro da média,4.19,Etanol
ATHOS AUTO POSTO LTDA,SP,SAO BERNARDO DO CAMPO,"Rua AV ROBERT KENNEDY, 3644, S/N","-2,77%",✅ Dentro da média,4.19,Etanol
AUTO POSTO FENIX JAPAO,SP,MOGI DAS CRUZES,"Rua AV.  JAPAO 1363, S/N","-2,77%",✅ Dentro da média,4.19,Etanol
AUTO POSTO GUARDAMOR,SP,SAO SEBASTIAO,"Rua AV GUARDAMOR LOBO VIANA 375,","-2,77%",✅ Dentro da média,4.19,Etanol
AUTO POSTO IRMAOS BENTO,SP,GUARUJA,"Avenida SANTOS DUMONT, 2611","-2,77%",✅ Dentro da média,4.19,Etanol
AUTO POSTO PORTAL DO RIO REAL,SP,GUARULHOS,"Rua RUA  MACAMBAU, S/N","-2,77%",✅ Dentro da média,4.19,Etanol
AUTO POSTO REFERENCIA,MS,CAMPO GRANDE,"Rua AVENIDA GUAICURUS, S/N","-2,77%",✅ Dentro da média,4.19,Etanol
AUTOPOSTO PALMAS,MG,UBERLANDIA,"Rua AV GETULIO VARGAS 3030, S/N","-2,77%",✅ Dentro da média,4.19,Etanol
CENTRO AUTOMOTIVO MOURISCO LTDA,SP,SAO PAULO,"Área AVENIDA REGENTE FEIJO 1111,","-2,77%",✅ Dentro da média,4.19,Etanol
CENTRO AUTOMOTIVOS MARINAS,SP,SAO VICENTE,"Rua AV CAP MOR AGUIAR 10, S/N","-2,77%",✅ Dentro da média,4.19,Etanol
CENTRO AUTSELENE,SP,POA,"Rua R JOAO PEKNY 1210, S/N","-2,77%",✅ Dentro da média,4.19,Etanol
DECIO AUTO POSTO,MG,UBERLANDIA,"Rua ANEL VIARIO AYRTON SENNA, S/","-2,77%",✅ Dentro da média,4.19,Etanol
DECIO UBERLANDIA,MG,CRUZEIRO DOS PEIXOTOS,"Rua ROD BR 050 KM 85,8, S/N","-2,77%",✅ Dentro da média,4.19,Etanol
JEQUITIBA COMERCIO DE COMBUSTIV,PR,ROLANDIA,"Área AVENIDA GETULIO VARGAS, 699","-2,77%",✅ Dentro da média,4.19,Etanol
POSTO A ALVES PARA-SHELL,SP,ORLANDIA,R 4 397,"-2,77%",✅ Dentro da média,4.19,Etanol
POSTO ANDRADE,PR,CAMPO MOURAO,Rua R.  MIGUEL LUIZ PEREIRA 1496,"-2,77%",✅ Dentro da média,4.19,Etanol
POSTO BRILHANTE,MS,CAMPO GRANDE,"Rua AV BANDEIRANTES 1004, S/N","-2,77%",✅ Dentro da média,4.19,Etanol
POSTO CAMPO VERDE,SP,MAUA,"Avenida BARAO DE MAUA, 2204","-2,77%",✅ Dentro da média,4.19,Etanol
POSTO COLONIAL -SHELL,SP,CAMPINAS,Rua R. GEN MARCONDES SALGADO 850,"-2,77%",✅ Dentro da média,4.19,Etanol
POSTO DE COMBUSTIVEIS R13 SANTA,DF,BRASILIA,"Rua QUADRA AC 219 CONJUNTO A, LO","-2,77%",✅ Dentro da média,4.19,Etanol
POSTO MONTECARLO,SP,RIBEIRAO PRETO,"Rua AV CARAMURU 1841, S/N","-2,77%",✅ Dentro da média,4.19,Etanol
Posto Piloto,PR,MARIALVA,"Área R PADRE THEO HERMANN, 816,","-2,77%",✅ Dentro da média,4.19,Etanol
POSTO PINDA DUTRA LTDA,SP,PINDAMONHANGABA,"Área ROD PRESIDENTE DUTRA, KM 94","-2,77%",✅ Dentro da média,4.19,Etanol
POSTO QUALITY SUPRA LTDA,SP,SUZANO,"Estrada DOS FERNANDES, 2286","-2,77%",✅ Dentro da média,4.19,Etanol
POSTO ZZ UBERLANDIA,MG,UBERLANDIA,Rua AV.  PAULO ROBERTO CUNHA S 1,"-2,77%",✅ Dentro da média,4.19,Etanol
RA MAHLE,PR,DIAMANTE DO NORTE,"Rua ROD PR-182, S/N","-2,77%",✅ Dentro da média,4.19,Etanol
REDE FLOR CALMON,SP,SAO PAULO,"Rua TIBURCIO DE SOUSA, 1285","-2,77%",✅ Dentro da média,4.19,Etanol
RODOPOSTO BANDEIRANTES 81 LTDA,SP,CAMPINAS,"Área Rodovia dos Bandeirantes, S","-2,77%",✅ Dentro da média,4.19,Etanol
TOPAZIO,SP,SAO PAULO,"Rua ROD ANHANGUERA KM 140, S/N","-2,77%",✅ Dentro da média,4.19,Etanol
VIELFE M AUTO POSTO-SHELL,SP,SAO PAULO,"Avenida SAPOPEMBA, 20020","-2,77%",✅ Dentro da média,4.19,Etanol
COCAMAR POSTO DE COMBUSTIVIES,PR,MARINGA,Rodovia ROD PR317 SAIDA PARA CAM,"-2,77%",✅ Dentro da média,4.1899999999999995,Etanol
KLL POSTO DE ABAST E-SHELL,SP,MAUA,"Rua AV. PAPA JOAO XXIII 2009, S/","-2,77%",✅ Dentro da média,4.1899999999999995,Etanol
TROKAR 4,MS,CAMPO GRANDE,"Área AVENIDA MARECHAL DEODORO, 6","-2,77%",✅ Dentro da média,4.1899999999999995,Etanol
POSTO TRIANGULO,PI,PARNAIBA,"Avenida NOSSA SENHORA DE FATIMA,","-2,92%",✅ Dentro da média,6.035884398976983,Gasolina Comum
POSTO BOAVENTURA,CE,FORTALEZA,"Rua AV.  GODOFREDO MACIEL, 6060,","-2,93%",✅ Dentro da média,5.77,Diesel
POSTO SANTA INES,CE,MARACANAU,"Rua DR MENDEL STEINBRUCH, S/N","-2,93%",✅ Dentro da média,5.77,Diesel
POSTO ZONA SUL,SP,RIBEIRAO PRETO,Rua AV.  CARLOS EDUARDO DE GAS 1,"-2,99%",✅ Dentro da média,4.180213068181819,Etanol
POSTO DON INACIO-BANDEIRA BRANCA,MG,GUAXUPE,AV DONA FLORIANA 1709,"-3,01%",✅ Dentro da média,4.179666241108882,Etanol
