Nome EC,UF EC,Cidade EC,Logradouro EC,Desvio de Preço (%),Blacklist,Preço por Litro,Mercadoria
LAVA JATO DO GAUCHO,PE,RECIFE,"Área R MOISES CORREA DA SILVA, 4","1204,94%",🔴 Muito acima da média,50,Arla 32
POSTO AEROPORTO,ES,VITORIA,Rua AVENIDA ADALBERTO SIMAO NADE,"1111,55%",🔴 Muito acima da média,60,Lava-Rápido
POSTO FORMULA 1,PR,MARINGA,"Rua PC.  LUIZ GONZAGA 36, S/N","1111,55%",🔴 Muito acima da média,60,Lava-Rápido
LAVA JATO BRASLANDCAR LTDA - ME,DF,BRASILIA,"Rua CSG 13, S/N","970,21%",🔴 Muito acima da média,53,Lava-Rápido
PETROBULL,MG,ARAXA,"Rua AV AMAZONAS 308, S/N","922,22%",🔴 Muito acima da média,44.05,Etanol
AUTO POSTO 2000,MG,CAMPOS ALTOS,Área AV NILTON FERREIRA DE PAIV,"909,63%",🔴 Muito acima da média,50,Lava-Rápido
LAVA JATO DO GAUCHO,PE,RECIFE,"Área R MOISES CORREA DA SILVA, 4","909,63%",🔴 Muito acima da média,50,Lava-Rápido
POSTO ESQUINAO,MG,UBERABA,"Área RODOLFO LIRIO 480, 480, 480","909,63%",🔴 Muito acima da média,50,Lava-Rápido
R H CARDOSO SERV AUTOMOTORES ME,RJ,RIO DAS OSTRAS,AV ALCEBIADES S SANTOS   000000Q,"909,63%",🔴 Muito acima da média,50,Lava-Rápido
POSTO DON INACIO-BANDEIRA BRANCA,MG,GUAXUPE,AV DONA FLORIANA 1709,"786,45%",🔴 Muito acima da média,43.9,Lava-Rápido
AUTO POSTO G4 LTDA,SP,MAUA,"Rua AVENIDA JOAO RAMALHO, 150 4B","738,77%",🔴 Muito acima da média,41.53846153846154,Lava-Rápido
BORRACHARIA E LAVA JATO ESMERALD,MS,CAMPO GRANDE,"AVENIDA MANOEL DA COSTA LIMA, 14","707,70%",🔴 Muito acima da média,40,Lava-Rápido
POSTO DUAS COLUNAS,RJ,TRES RIOS,Rua AV. CONDESSA DE RIO NOVO 105,"606,74%",🔴 Muito acima da média,35,Lava-Rápido
AUTO POSTO DF 180,GO,AGUAS LINDAS DE GOIAS,Área QUADRA 8 SN LT 16 17 E 18 S,"177,77%",🔴 Muito acima da média,17.27,Gasolina Comum
MINUTUS COMBUSTIVEIS,RJ,CARMO,"Área RUA JOSE RIBEIRO DE MOURA,","61,28%",🔴 Muito acima da média,6.95,Etanol
BULL PETROLEO,MG,ARAXA,"Rua AV WILSON BORGES 605, S/N","56,64%",🔴 Muito acima da média,6.75,Etanol
POSTO ITAPERY,CE,FORTALEZA,"Rua AV. PRES COSTA E SILVA 2721,","56,33%",🔴 Muito acima da média,5.99,Arla 32
A P ANTONIO EMERICK,SP,SAO VICENTE,"Rua AV. ANTONIO EMMERICK 46, S/N","48,29%",🔴 Muito acima da média,6.39,Etanol
ECOILHA,SP,ILHABELA,"Área AV PRINCESA ISABEL 2284, S/","48,29%",🔴 Muito acima da média,6.39,Etanol
POSTO MALACARNE,ES,VILA VELHA,"Avenida SERGIO CARDOSO, 00","46,85%",🔴 Muito acima da média,9.13,Gasolina Comum
CARREFOUR ESV,SP,SAO PAULO,"Rua AV CARLOS LINDENBERG 4393, S","46,81%",🔴 Muito acima da média,6.326397919375812,Etanol
POSTO NOSSA SENHORA DA ROSA MIST,MS,CAMPO GRANDE,"Rua R. CHAPARRAL,21, S/N","42,48%",🔴 Muito acima da média,6.14,Etanol
POSTO PRADO,RJ,NOVA FRIBURGO,"Área AVENIDA GOV ROBERTO SILVEI,","39,24%",🔴 Muito acima da média,6,Etanol
AUTO POSTO FLOSI,SP,SAO VICENTE,Avenida DEPUTADO ULISSES GUIMARA,"31,35%",🔴 Muito acima da média,5.66,Etanol
POSTO ANCORA,RJ,RIO DAS OSTRAS,"Rua AV. DAS CASUARINAS SN, S/N","31,25%",🔴 Muito acima da média,8.16,Gasolina Comum
POSTO BELA TERRA MUIRAQUITA,PA,SANTAREM,"AV SERGIO HENN, 435","27,87%",🔴 Muito acima da média,7.95,Gasolina Comum
FC COMBUSTIVEIS,MA,CODO,"Avenida SANTOS DUMONT, 1831","26,58%",🔴 Muito acima da média,7.87,Gasolina Comum
REDE CEARA OUTLET,CE,CAUCAIA,"Área ROD. BR 020, KM 14,5, 6354,","26,47%",🔴 Muito acima da média,5.45,Etanol
POSTO CAMPO VERDE,SP,MAUA,"Avenida BARAO DE MAUA, 2204","25,73%",🔴 Muito acima da média,6.39,Gasolina Aditivada
AUTO POSTO DOI21894,MA,BARRA DO CORDA,"Rua RIO TEFE, 653","25,13%",🔴 Muito acima da média,7.779999999999999,Gasolina Comum
POSTO CEMOPEL 3,PE,OLINDA,"Rua AV DR JOAQUIM NABUCO 1600, S","25,13%",🔴 Muito acima da média,7.779999999999999,Gasolina Comum
POSTO RIO NEGRO,RJ,COMENDADOR LEVY GASPARIAN,"Rua ROD BR 40 KM 6, S/N","25,08%",🔴 Muito acima da média,5.39,Etanol
POSTO COQUEIRAL,RJ,ARARUAMA,"Rua ROD AMARAL PEIXOTO 90031, S/","24,97%",🔴 Muito acima da média,7.77,Gasolina Comum
ALESSANDRA,RJ,RIO DE JANEIRO,"Área ROD BR 101  SN KM 154/6, S/","24,71%",🔴 Muito acima da média,7.329999999999999,Diesel S10
POSTO CANOEIRO,MA,GRAJAU,"Rua ROD BR 226 KM 216, S/N","24,38%",🔴 Muito acima da média,5.36,Etanol
AUTO POSTO ALEX,CE,IGUATU,"Rua RUA JULIO CAVALCANTE, 50, S/","24,20%",🔴 Muito acima da média,7.299999999999999,Diesel S10
POSTO APM,PE,PAULISTA,"Rua AV SEN SALGADO FILHO 18, S/N","24,01%",🔴 Muito acima da média,7.71,Gasolina Comum
LEO COMERCIO DE DERIVADOS DE PE,CE,FORTALEZA,"Rua AVENIDA CEL CARVALHO, S/N","23,69%",🔴 Muito acima da média,7.6899999999999995,Gasolina Comum
POSTO ITAMARATY,PE,SALGUEIRO,"Rua JOAO VERAS DE SIQUEIRA, 1721","22,84%",🔴 Muito acima da média,7.219999999999999,Diesel S10
POSTO 4 IRMAOS,RJ,ARROZAL,"Rua ROD PRES DUTRA KM 252, S/N","22,76%",🔴 Muito acima da média,5.29,Etanol
POSTO IPOJUCA,PE,IPOJUCA,"Rua ROV PE, 60","22,40%",🔴 Muito acima da média,7.61,Gasolina Comum
PONTES & LANDIM COMBUSTIVEIS,CE,CAUCAIA,Rua RODOVIA  ESTRUTURANTE - CE 0,"22,08%",🔴 Muito acima da média,7.590000000000001,Gasolina Comum
POSTO PEDRAS,CE,EUSEBIO,"Rua RODOVIA BR 116, 7844 KM 16,","22,08%",🔴 Muito acima da média,7.59,Gasolina Comum
BRASAL COMBUSTIVEIS P-,DF,BRASILIA,"Rua SETOR HOTELEIRO SUL S/N, S/N","21,83%",🔴 Muito acima da média,5.25,Etanol
ALESAT POSTO PE CICERO 01,CE,JUAZEIRO DO NORTE,"Avenida PADRE CICERO, 2506","20,92%",🔴 Muito acima da média,6.65,Diesel S50
AUTO POSTO TIGRAO,CE,FORTALEZA,"Rua BR 116 KM 12    2928, S/N","20,63%",🔴 Muito acima da média,7.5,Gasolina Comum
POSTO CRISTAL,CE,CAUCAIA,"Área AV D ALMEIDA LUSTOSA, 3202,","20,47%",🔴 Muito acima da média,7.489999999999999,Gasolina Comum
POSTO MONTREAL,CE,FORTALEZA,Área AVENIDA AV JOAO PESSOA 6094,"20,47%",🔴 Muito acima da média,7.489999999999999,Gasolina Comum
POSTO ANCORA,RJ,RIO DAS OSTRAS,"Rua AV. DAS CASUARINAS SN, S/N","19,50%",🟠 Acima da média,7.43,Gasolina Comum
POSTO ITAIPAVA LTDA,RJ,PETROPOLIS,Rua EST.  UNIAO E INDUSTRIA 1042,"19,28%",🟠 Acima da média,5.14,Etanol
AUTO POSTO ALEX,CE,IGUATU,"Rua RUA JULIO CAVALCANTE, 50, S/","18,93%",🟠 Acima da média,6.990000000000001,Diesel S10
POSTO CAMBEBA,CE,FORTALEZA,"Rua AV WASHINGTON SOARES 5501, S","18,93%",🟠 Acima da média,6.99,Diesel S10
POSTO CANADA,CE,FORTALEZA,"Rua AV.  TREZE DE MAIO 980, S/N","18,93%",🟠 Acima da média,6.99,Diesel S10
POSTOS CURRAIS NOVOS,RN,CURRAIS NOVOS,Rua AV DR SILVIO DE BEZ MELO 865,"18,93%",🟠 Acima da média,6.99,Diesel S10
POST0 PETROBRAS,CE,CAMPOS SALES,Rua AVE. 7 DE SETEMBRO 441 CENTR,"18,93%",🟠 Acima da média,6.989999999999999,Diesel S10
POSTO IGUATU,CE,IGUATU,"Rua AV CRUZEIRO DO SUL 996, S/N","18,93%",🟠 Acima da média,6.989999999999999,Diesel S10
POSTO PIONEIRO,CE,FORTALEZA,"Rua AV A 855 3 ETAPA, S/N","18,93%",🟠 Acima da média,6.989999999999999,Diesel S10
POSTO PONTE,CE,CAUCAIA,"Rua AV.  ULISSES GUIMARAES S/N,","18,93%",🟠 Acima da média,6.989999999999999,Diesel S10
POSTO UNIAO,RJ,PETROPOLIS,"Estrada UNIAO E INDUSTRIA, 4500","18,70%",🟠 Acima da média,7.38,Gasolina Comum
AUTO POSTO JOTI,SP,CARAGUATATUBA,"Rua AV PRES CAMPOS SALLES 450, S","18,35%",🟠 Acima da média,5.1,Etanol
MD COMERCIO DE DERIVADOS DE PETR,CE,FORTALEZA,"Avenida GODOFREDO MACIEL, 1725","18,31%",🟠 Acima da média,7.355574357953414,Gasolina Comum
AUTO POSTO DOIS IRMAOS,CE,NOVA OLINDA,"Rua SITO JACUZ CE 292 SN, S/N","18,26%",🟠 Acima da média,7.03,Diesel
POSTO SUL-SHELL,CE,FORTALEZA,"Rua ROD.  BR-116 KM 07 N 2620, S","18,22%",🟠 Acima da média,7.35,Gasolina Comum
PONTES & LANDIM COMBUSTIVEIS,CE,CAUCAIA,Rua RODOVIA  ESTRUTURANTE - CE 0,"17,76%",🟠 Acima da média,7,Diesel
POST0 PETROBRAS,CE,CAMPOS SALES,Rua AVE. 7 DE SETEMBRO 441 CENTR,"17,59%",🟠 Acima da média,6.99,Diesel
POSTO IGUATU,CE,IGUATU,"Rua AV CRUZEIRO DO SUL 996, S/N","17,59%",🟠 Acima da média,6.99,Diesel
POSTO MONTREAL,CE,FORTALEZA,Área AVENIDA AV JOAO PESSOA 6094,"17,59%",🟠 Acima da média,6.989999999999999,Diesel
POSTO SAO JOSE RIBAMAR,PA,CASTANHAL,Rua AV. PRES GETULIO VARGAS 1903,"17,40%",🟠 Acima da média,6.9,Diesel S10
AUTO POSTO NOVO HORIZONTE,MG,BOA ESPERANCA,"Rua MARIQUINHA GOMES, 903","17,28%",🟠 Acima da média,6.45,Diesel S50
PIT STOP,RJ,TERESOPOLIS,"Rua AV ALBERTO TORRES 569, S/N","17,25%",🟠 Acima da média,7.29,Gasolina Comum
POSTO AVENIDA,CE,ASSARE,"Rua ROD PERIMENTRAL KM 2, S/N","17,23%",🟠 Acima da média,6.89,Diesel S10
POSTO SAO MATEUS,DF,BRASILIA,"Rua QNM 34 AREA ESP A S/N, S/N","17,19%",🟠 Acima da média,5.05,Etanol
POSTO ZAMBIASI,MG,SAO SEBASTIAO DO PARAISO,"Rua ROD MG 050, S/N","17,19%",🟠 Acima da média,5.05,Etanol
POSTO MAGALHAES VI,CE,CAUCAIA,"Área RUA JUACI SAMPAIO PONTES, 3","16,94%",🟠 Acima da média,7.270751068694702,Gasolina Comum
POSTO PROGRESSO,CE,MARANGUAPE,"Rua AV DR STENIO GOMES 991, S/N","16,77%",🟠 Acima da média,7.259999999999999,Gasolina Comum
POSTO SANTANA,MA,MATOES,AVENIDA GETULIO VARGAS 23 2398,"16,61%",🟠 Acima da média,7.25,Gasolina Comum
POSTO GIPAGEL II,PB,PATOS,"Rua CARREIROS, 3","16,55%",🟠 Acima da média,6.41,Diesel S50
CARIRI COMBUSTIVEIS,CE,JUAZEIRO DO NORTE,"Área AVENIDA GOV VIRGILIO TAVOR,","16,55%",🟠 Acima da média,6.85,Diesel S10
POSTO MAGALHAES III,CE,MARACANAU,Rua RUA HERMES CASTELO BRANCO 41,"16,14%",🟠 Acima da média,7.220576164874552,Gasolina Comum
POSTO MAGALHAES X,CE,MARACANAU,Rua AV PE JOSE HOLANDA DO VALE S,"16,05%",🟠 Acima da média,7.215050974780898,Gasolina Comum
AUTO POSTO ASA DELTA,SP,CARAGUATATUBA,Rua R BENEDITO R DOS SANTOS FILH,"16,03%",🟠 Acima da média,5,Etanol
AUTO POSTO G4 LTDA,SP,MAUA,"Rua AVENIDA JOAO RAMALHO, 150 4B","16,03%",🟠 Acima da média,5,Etanol
POSTO ESTRELA,CE,CANINDE,"Rua AV LUCIANO MAGALHAES 105, S/","15,80%",🟠 Acima da média,7.2,Gasolina Comum
AUTO POSTO GUARDAMOR,SP,SAO SEBASTIAO,"Rua AV GUARDAMOR LOBO VIANA 375,","15,80%",🟠 Acima da média,4.99,Etanol
BARROS AUTO POSTO,RJ,APERIBE,"Rua RODOVIA RJ 116 KM 205,5, S/N","15,80%",🟠 Acima da média,4.99,Etanol
D F SOUZA FILHO LTDA,RJ,SAPUCAIA,"Rua R RAFAEL LANGONI 105, S/N","15,80%",🟠 Acima da média,4.99,Etanol
MACHADO R. P. COMERCIO DE COMBU,SP,RIBEIRAO PRETO,"Avenida DEZENOVE DE JUNHO, 401","15,80%",🟠 Acima da média,4.99,Etanol
POSTO CRUZEIRO DO SUL,SP,GUARULHOS,"Rua AV.  SANTOS DUMONT 2302, S/N","15,80%",🟠 Acima da média,4.99,Etanol
POSTO DE COMBUSTIVEIS EPIA CANDA,DF,BRASILIA,"Rua ST DE POSTOS E MOTEIS SUL I,","15,80%",🟠 Acima da média,4.99,Etanol
A POSTO NOVOS TEMPOS,SP,PRAIA GRANDE,"Rua AV. PRES KENNEDY 6450, S/N","15,80%",🟠 Acima da média,4.989999999999999,Etanol
FRANGO ASSADO PEDRO 66 SERVICOS,SP,ATIBAIA,"Rodovia DOM PEDRO I, 3","15,80%",🟠 Acima da média,4.989999999999999,Etanol
AUTO POSTO SHOP CAR,MA,SENADOR LA ROCQUE,"Área AV MOTA E SILVA, S/N","15,71%",🟠 Acima da média,7.194319110304131,Gasolina Comum
POSTO FLEX,CE,FORTALEZA,"Avenida FRANCISCO SA, 2707","15,64%",🟠 Acima da média,7.19,Gasolina Comum
BRASAL COMBUSTIVEIS P-,DF,BRASILIA,"Rua SETOR HOTELEIRO SUL S/N, S/N","15,60%",🟠 Acima da média,4.981295678105666,Etanol
POSTO ACUSTIC,CE,FORTALEZA,"Rua AV.  AUGUSTO DOS ANJOS 472,","15,53%",🟠 Acima da média,6.790000000000001,Diesel S10
FRANGO ASSADO POSTO TAUBATE,SP,TAUBATE,"Rodovia PRESIDENTE DUTRA, 3","15,53%",🟠 Acima da média,6.79,Diesel S10
POSTO MONOLITOS,CE,QUIXADA,"Rua AV PLACIDO CASTELO 1599, S/N","15,53%",🟠 Acima da média,6.79,Diesel S10
AUTO POSTO MD,PE,PALMARES,"Rua BR101, KM 184/85, S/N","15,48%",🟠 Acima da média,7.18,Gasolina Comum
PONTES & LANDIM COMBUSTIVEIS,CE,CAUCAIA,Rua RODOVIA  ESTRUTURANTE - CE 0,"15,37%",🟠 Acima da média,7.172951705232606,Gasolina Comum
POSTO ACOPIARA,CE,SENADOR POMPEU,"Rua PRACA SAO SEBASTIAO, 100, S/","15,19%",🟠 Acima da média,6.77,Diesel S10
AS ILHAS AUTO POSTO,SP,SAO SEBASTIAO,Área RUA MANOEL MARCELINO DE MAT,"15,03%",🟠 Acima da média,4.956788216300026,Etanol
P.CACIQUE 15,PI,TERESINA,"Avenida MARANHAO, 3399","15,00%",🟠 Acima da média,7.15,Gasolina Comum
POSTO BEBERIBE,CE,BEBERIBE,AV VICENTE MARTINS DOURADO 721,"14,97%",🟠 Acima da média,7.147927818496254,Gasolina Comum
POSTO CUNHA III COM COMBUSTIVEL,PE,ABREU E LIMA,"Rua AV. DQ CAXIAS 1708, S/N","14,73%",🟠 Acima da média,7.133011442314699,Gasolina Comum
POSTO SAO FRANCISCO,CE,QUIXADA,"Rua R RODRIGUES JR  947, S/N","14,68%",🟠 Acima da média,6.74,Diesel S10
AUTO POSTO CALUNGA LTD,SP,SAO VICENTE,"Rua AV.  ANTONIO EMMERICK 1445,","14,66%",🟠 Acima da média,4.940769230769231,Etanol
EURO GAS,DF,BRASILIA,"Rua QS 9 R 123 L 06 / 14, S/N","14,58%",🟠 Acima da média,4.937393873250038,Etanol
POSTO JORGE VIEIRA,CE,FORTALEZA,"Rua AV PONTES VIEIRA, S/N","14,39%",🟠 Acima da média,6.8,Diesel
POSTO MONOLITOS,CE,QUIXADA,"Rua AV PLACIDO CASTELO 1599, S/N","14,23%",🟠 Acima da média,6.79,Diesel
REDE PRESIDENTE,SE,ARACAJU,"Rua AV PRES TANCREDO NEVES 4930,","14,23%",🟠 Acima da média,6.79,Diesel
BRASAL COMBUSTIVEIS P-SHELL,DF,BRASILIA,"Rua QI 416, CJ H LT 1, S/N","14,04%",🟠 Acima da média,7.09,Gasolina Comum
POSTO PASSARE,CE,FORTALEZA,"Rua AV DR  SILAS MUNGUBA  5555,,","14,04%",🟠 Acima da média,7.09,Gasolina Comum
POSTO ESTRELA,CE,FORTALEZA,"Rua R PROF HERIBALDO COSTA 450,","13,99%",🟠 Acima da média,6.7,Diesel S10
LEAL IV COMERCIO DE PETROLEO LT,CE,FORTALEZA,"Rua ROD BR 116 11055, S/N","13,87%",🟠 Acima da média,7.080000000000001,Gasolina Comum
POSTO UIRAPURU,CE,FORTALEZA,"Rua AV ALBERTO CRAVEIRO 1973, S/","13,87%",🟠 Acima da média,7.08,Gasolina Comum
COMERCIAL D2 DE COMBUSTIVEIS LT,CE,ITAPIPOCA,"Área Rua Vicente Siebra, 3701","13,82%",🟠 Acima da média,6.69,Diesel S10
POSTO BOAVENTURA,CE,FORTALEZA,"Rua AV.  GODOFREDO MACIEL, 6060,","13,82%",🟠 Acima da média,6.69,Diesel S10
POSTO ESTRUTURANTE,CE,CAUCAIA,"Rua RODOVIA CE 085 - KM 02, S/N","13,82%",🟠 Acima da média,6.69,Diesel S10
POSTO TAVARES,CE,SAO GONCALO DO AMARANTE,"Rua ROD BR 222 KM 63, S/N","13,82%",🟠 Acima da média,6.69,Diesel S10
AUTO POSTO DOI21894,MA,BARRA DO CORDA,"Rua RIO TEFE, 653","13,79%",🟠 Acima da média,7.075010176304476,Gasolina Comum
QS COMBUSTIVEIS,CE,EUSEBIO,"Avenida EUSEBIO DE QUEIROZ, 2651","13,71%",🟠 Acima da média,7.069985855728429,Gasolina Comum
AUTO POSTO BR 060,DF,BRASILIA,"Rua QS 517, S/N","13,71%",🟠 Acima da média,4.9,Etanol
S.E.L.LTDA,PA,SANTAREM,"Rua AVENIDA DR ANISIO CHAVES, 00","13,62%",🟠 Acima da média,7.064220831651191,Gasolina Comum
POSTO CAMBEBA,CE,FORTALEZA,"Rua AV WASHINGTON SOARES 5501, S","13,62%",🟠 Acima da média,7.0640324554961,Gasolina Comum
POSTO DE SERVICOS,SP,BERTIOGA,"Rua RD RIO SANTOS KM, S/N","13,53%",🟠 Acima da média,4.892229150428683,Etanol
POSTO IPOJUCA,PE,IPOJUCA,"Rua ROV PE, 60","13,50%",🟠 Acima da média,7.056736267174922,Gasolina Comum
POSTO SANTO ANTONIO,MG,SACRAMENTO,Rua R MAJ ATALIBA JOSE DA CUNHA,"13,48%",🟠 Acima da média,4.890000000000001,Etanol
AUTO POSTO ALFA,MG,PASSOS,"Rua R. DOS COMERCIANTES 1010, S/","13,48%",🟠 Acima da média,4.89,Etanol
AUTO POSTO LA CANIZA LTDA,SP,GUARUJA,"Rua AV ADHEMAR DE BARROS 2795, S","13,48%",🟠 Acima da média,4.89,Etanol
AUTO POSTO MAR AZUL,SP,SANTOS,Rua AV. PRF ARISTOTELES MENEZES,"13,48%",🟠 Acima da média,4.89,Etanol
AUTO POSTO TREMEMBE,SP,SAO PAULO,"Rua AV.  NOVA CANTAREIRA 4892, S","13,48%",🟠 Acima da média,4.89,Etanol
POSTO PRODOESTE UBERABA,MG,UBERABA,"Rua R.  ARLINDO MELO BL C 1675,","13,48%",🟠 Acima da média,4.89,Etanol
POSTO VEREDAS EXPRESS,MG,MURIAE,"Avenida DONA MARICAS, 50","13,48%",🟠 Acima da média,4.89,Etanol
SKINA AUTO POSTO,MG,ARAXA,"Rua AV.  HITALO ROS 785, S/N","13,48%",🟠 Acima da média,4.89,Etanol
POSTO AVENIDA,SP,GUARUJA,"Rua AV PUGLISI 610, S/N","13,48%",🟠 Acima da média,4.889999999999999,Etanol
AVANTI PETROLEO,CE,JUAZEIRO DO NORTE,AVENIDA GOVERNADOR VIRGILIO TAVO,"13,46%",🟠 Acima da média,6.24,Diesel S50
LINS E LEITE LTDA,PE,IPOJUCA,"Rua ROV PE, 60","13,41%",🟠 Acima da média,7.0512702976995945,Gasolina Comum
AC TRANCOZO,RJ,NOVA FRIBURGO,"Rua AV. PRES COSTA E SILVA 11, S","13,39%",🟠 Acima da média,7.05,Gasolina Comum
POSTO CIDADE,PE,SANTA MARIA DA BOA VISTA,"Avenida RECIFE, 616","13,39%",🟠 Acima da média,7.05,Gasolina Comum
POSTO CUNHA,PE,RECIFE,Rua AV. MAL MASCARENHAS DE MORAI,"13,39%",🟠 Acima da média,7.05,Gasolina Comum
AUTO POSTO VIA PRAIA,SP,SANTOS,"Rua R.  ALEXANDRE MARTINS 61, S/","13,25%",🟠 Acima da média,4.88,Etanol
POSTO PADRE CICERO 08,CE,JUAZEIRO DO NORTE,"Rua AV PADRE CICERO 2200, S/N","13,14%",🟠 Acima da média,6.650000000000001,Diesel S10
ALESAT POSTO PE CICERO 01,CE,JUAZEIRO DO NORTE,"Avenida PADRE CICERO, 2506","13,14%",🟠 Acima da média,6.65,Diesel S10
AVANTI PETROLEO,CE,JUAZEIRO DO NORTE,AVENIDA GOVERNADOR VIRGILIO TAVO,"13,14%",🟠 Acima da média,6.65,Diesel S10
POSTO DA ILHA,PE,ILHA DE ITAMARACA,RODOVIA MARIO MELO PE 35 KM  00,"13,07%",🟠 Acima da média,7.03,Gasolina Comum
POSTO PAGUE MENOS,CE,ANTONINA DO NORTE,"Rua AV NELITO MENDES, S/N","12,96%",🟠 Acima da média,6.639059154929577,Diesel S10
POSTO DA ILHA,ES,VITORIA,"Rua AV.  LEITAO DA SILVA N 420,","12,84%",🟠 Acima da média,7.015753920386007,Gasolina Comum
POSTO CATATAU,CE,TIANGUA,Área AVENIDA JOSE EVANGELISTA DE,"12,81%",🟠 Acima da média,7.014117647058824,Gasolina Comum
POSTO CIDADE,PI,BURITI DOS LOPES,Rua R DR JOAQUIM NARCISO DE OLIV,"12,80%",🟠 Acima da média,6.63,Diesel S10
POSTO V1,CE,FORTALEZA,AVENIDA AV AV RAD JOAO RAMOS 126,"12,66%",🟠 Acima da média,7.004573694646397,Gasolina Comum
REDE PRESIDENTE- FILIAL BARRA,SE,BARRA DOS COQUEIROS,"Rua R SAO MATHEUS SN, S/N","12,59%",🟠 Acima da média,7,Gasolina Comum
AUTO POSTO BETMAR PAR-SHELL,SP,BERTIOGA,"Rua R MANOEL GAJO 1900, S/N","12,55%",🟠 Acima da média,4.85,Etanol
POSTO ALBATROZ,SP,BERTIOGA,"Rua AVENIDA  19 DE MAIO, S/N","12,55%",🟠 Acima da média,4.85,Etanol
POSTO RODOBELO,DF,BRASILIA,"Rua DF 001  KM 58.8, S/N","12,55%",🟠 Acima da média,4.85,Etanol
PETRO COM DE COMBUSTIVEIS,MA,BALSAS,"Rua AV GOV LUIZ ROCHA 41 B, S/N","12,54%",🟠 Acima da média,6.6899999999999995,Diesel
AUTO POSTO ALVORADA 2,MA,IMPERATRIZ,Rua ROD.  BR-010 N335 ENTROCAMEN,"12,52%",🟠 Acima da média,6.995854672588113,Gasolina Comum
AUTO POSTO TIGRAO,CE,FORTALEZA,"Rua BR 116 KM 12    2928, S/N","12,44%",🟠 Acima da média,6.9906969924299265,Gasolina Comum
POSTO CARIBE,CE,FORTALEZA,"Rua AV ENG SANTANA JUNIOR 2900,","12,43%",🟠 Acima da média,6.990000000000001,Gasolina Comum
POSTO GAUCHAO,RJ,TRES RIOS,"Rua EST UNIAO INDUSTRIA BR, S/N","12,43%",🟠 Acima da média,6.990000000000001,Gasolina Comum
POSTO II PVEX,CE,FORTALEZA,Rua AV. MINISTRO JOSE AMERICO 53,"12,43%",🟠 Acima da média,6.990000000000001,Gasolina Comum
POSTO II PVEX LESTE,CE,AQUIRAZ,"Rua RODOVIA CE 040, S/N","12,43%",🟠 Acima da média,6.990000000000001,Gasolina Comum
AUTO POSTO MONTECASEROS LTDA,RJ,PETROPOLIS,"Rua RUA MONTECASEROS, 165, S/N","12,43%",🟠 Acima da média,6.99,Gasolina Comum
AV. COMERCIO DE COMBUST VEL,ES,CACHOEIRO DE ITAPEMIRIM,Rua AV FRANCISCO LACERDA DE AGUI,"12,43%",🟠 Acima da média,6.99,Gasolina Comum
LEAL III COMERCIO DE P,CE,FORTALEZA,"Rua ROD BR 116,5541, S/N","12,43%",🟠 Acima da média,6.99,Gasolina Comum
POSTO ESSO,RJ,CAMBUCI,"Área R VICENTE BELO 179, S/N","12,43%",🟠 Acima da média,6.99,Gasolina Comum
POSTO GUARAVE,ES,GUARAPARI,Rua R.EWERSON DE ABREU SODRE 300,"12,43%",🟠 Acima da média,6.99,Gasolina Comum
POSTO JATOBA,BA,SALVADOR,"Área ROD BA 210 S/N KM 01, S/N","12,43%",🟠 Acima da média,6.99,Gasolina Comum
POSTO PORTAL DE SIRINHAEM,PE,SIRINHAEM,"Rua RODOVIA PE 60 KM 42 5 SN, S/","12,43%",🟠 Acima da média,6.99,Gasolina Comum
POSTO RECAMONDE,CE,FORTALEZA,"Rua AV.  GODOFREDO MACIEL 585, S","12,43%",🟠 Acima da média,6.99,Gasolina Comum
POSTO SERRANO,CE,BATURITE,"Rua RUA MAJOR CATAO, 233, S/N","12,43%",🟠 Acima da média,6.99,Gasolina Comum
POSTO VIA SUL,CE,FORTALEZA,"Rua AVENIDA  WASHINGTON SOARES,","12,43%",🟠 Acima da média,6.99,Gasolina Comum
REDE PRESIDENTE- FILIAL PATY,SE,ROSARIO DO CATETE,"Rua ROD BR 101 KM 575 SN, S/N","12,43%",🟠 Acima da média,6.99,Gasolina Comum
VIA SUL,CE,FORTALEZA,"Rua R. BR ARACATI 1747, S/N","12,43%",🟠 Acima da média,6.99,Gasolina Comum
AUTO POSTO PARATY,MA,IMPERATRIZ,AV BABACULANDIA 22,"12,43%",🟠 Acima da média,6.989999999999999,Gasolina Comum
POSTO VAQUEIRO,CE,EUSEBIO,Rua RODOVIA  ANEL VIARIO S/N KM,"12,42%",🟠 Acima da média,6.989576993155071,Gasolina Comum
AUTO POSTO SHOP CAR IV,MA,IMPERATRIZ,"Rua R RIO GRANDE DO NORTE, 436","12,41%",🟠 Acima da média,6.988966086803727,Gasolina Comum
POSTO BRASIL CACHOEIRO,ES,CACHOEIRO DE ITAPEMIRIM,"Rua PC GASTAO PIM 7/09, S/N","12,38%",🟠 Acima da média,6.987234726688103,Gasolina Comum
POSTO BOA ESPERANCA,PB,POMBAL,"Rua ROD BR 230, S/N","12,12%",🟠 Acima da média,6.590000000000001,Diesel S10
POSTO SOL E MAR,CE,SAO GONCALO DO AMARANTE,"Área ROD 156, S/N","12,12%",🟠 Acima da média,6.590000000000001,Diesel S10
POSTO 2000,CE,CEDRO,"Rua R DR. GUEDES MARTINS  520, S","12,12%",🟠 Acima da média,6.59,Diesel S10
POSTO AIUABA,CE,AIUABA,Rua R RAIMUNDO ARMANDO FEITOSA 6,"12,12%",🟠 Acima da média,6.59,Diesel S10
POSTO FREIRE,MG,UBERABA,"Área PC DOUTOR THOMAZ ULHOA, 500","12,12%",🟠 Acima da média,6.59,Diesel S10
POSTO DE COMBUSTIVEIS BOA ESPER,PB,POMBAL,"Rua ROD BR 230, S/N","12,12%",🟠 Acima da média,6.589999999999999,Diesel S10
POSTOS ALPA-SHELL,MG,ARAXA,"Rua AV MINISTRO OLAVO DRUOM 500,","12,12%",🟠 Acima da média,6.589999999999999,Diesel S10
II PVEX NORTE,CE,FORTALEZA,"Rua R CORON MATOS DOURADO 814, S","12,12%",🟠 Acima da média,6.970954547977135,Gasolina Comum
POSTO CAPEBE CAMPO MEIO,MG,CAMPO DO MEIO,"Rua R CONEGO VITOR 281, S/N","12,08%",🟠 Acima da média,4.83,Etanol
RIVA BEACH AUTO POSTO LTDA,SP,BERTIOGA,"Rua APROVADA RSL MOD VIVEIROS, 2","11,99%",🟠 Acima da média,4.826009156810377,Etanol
POSTO CARIOCA,CE,FORTALEZA,"Rua AV.  LUIZ  VIEIRA  835, S/N","11,97%",🟠 Acima da média,6.961720813995002,Gasolina Comum
LEO COMERCIO DE DERIVADOS DE PE,CE,FORTALEZA,"Rua AVENIDA CEL CARVALHO, S/N","11,95%",🟠 Acima da média,6.960590480119643,Gasolina Comum
POSTO MARATAIZES,ES,MARATAIZES,AV RUBENS RANGEL 1652,"11,94%",🟠 Acima da média,6.959999999999999,Gasolina Comum
CARIRI COMBUSTIVEIS,CE,JUAZEIRO DO NORTE,"Área AVENIDA GOV VIRGILIO TAVOR,","11,78%",🟠 Acima da média,6.95,Gasolina Comum
POSTO LAGO VERDE,CE,CAUCAIA,"Rua RODOVIA BR-222, S/N","11,78%",🟠 Acima da média,6.949999999999999,Gasolina Comum
MINUTUS COMBUSTIVEIS,RJ,CARMO,"Área RUA JOSE RIBEIRO DE MOURA,","11,77%",🟠 Acima da média,6.9490161192090625,Gasolina Comum
POSTO SETE CARIOCA,CE,HORIZONTE,ROD BR 116 42,"11,74%",🟠 Acima da média,6.947329520457545,Gasolina Comum
POSTO SETE CARIOCA,CE,HORIZONTE,"Rua AVENIDA PRES CASTELO BRANCO,","11,68%",🟠 Acima da média,6.943489387394918,Gasolina Comum
AUTO POSTO ROCHA,DF,BRASILIA,"Rua QN 502 CJ 21 LT 1/2, S/N","11,64%",🟠 Acima da média,4.810840539165819,Etanol
POSTO ECOLOGICO,CE,PARAIPABA,"Rua R. FELIPE DOS SANTOS N1, S/N","11,62%",🟠 Acima da média,6.940000000000001,Gasolina Comum
UNIPOSTO,ES,CACHOEIRO DE ITAPEMIRIM,Rua ROD.  CACHOEIRO X SAFRA KM 6,"11,62%",🟠 Acima da média,6.94,Gasolina Comum
RVM DO SUDOESTE -ESSO,MG,PASSOS,Rua AV. CDOR FRANCISCO A MAIA 43,"11,62%",🟠 Acima da média,4.81,Etanol
RECANTO OIL AUTO POSTO,DF,BRASILIA,"Rua QUADRA    LOTE 1 304, S/N","11,48%",🟠 Acima da média,4.803943217665616,Etanol
PEROLA CAPIXABA REVENDA DE PETR,ES,MARATAIZES,"Área AV  RUBENS RANGEL N 801, S/","11,47%",🟠 Acima da média,6.93072678730347,Gasolina Comum
POSTO SAO JUDAS TADEU LTDA,ES,CACHOEIRO DE ITAPEMIRIM,"Rua BERNARDO HORTA, 143","11,46%",🟠 Acima da média,6.93,Gasolina Comum
POSTO GASOLINA CAMURI,RJ,VOLTA REDONDA,"Rua R.  FERNANDO FERRARI 898, S/","11,30%",🟠 Acima da média,6.92,Gasolina Comum
POSTO SOL POENTE,CE,FORTALEZA,"Rua AVENIDA CEL CARVALHO, S/N","11,24%",🟠 Acima da média,6.916148312843316,Gasolina Comum
AUTO POSTO NOVO HORIZONTE,MG,BOA ESPERANCA,"Rua MARIQUINHA GOMES, 903","11,18%",🟠 Acima da média,4.790872017655356,Etanol
POSTO SAO FRANCISCO,CE,QUIXADA,"Rua R RODRIGUES JR  947, S/N","11,18%",🟠 Acima da média,6.912168214090662,Gasolina Comum
POSTO SERVI 100,CE,FORTALEZA,Rua AV  DESEMBARGADOR MOREIRA 25,"11,17%",🟠 Acima da média,6.9116506751954505,Gasolina Comum
AUTO POSTO 2000,MG,IBIA,"Rua AV BARTOLOMEU RIBEIRO DE P,","11,16%",🟠 Acima da média,4.79,Etanol
AUTO POSTO VERANEIO,SP,SANTOS,"Praça CORACAO DE MARIA, 23","11,16%",🟠 Acima da média,4.79,Etanol
AUTO POSTO VILA URUPES LTDA,SP,SUZANO,"Rua R.  CABOCLOS  N 470, S/N","11,16%",🟠 Acima da média,4.79,Etanol
POSTO TIGRE DO VALE//ESSO,SP,MOGI DAS CRUZES,"Rua ROD.  MOGI-DUTRA 600 KM 1, S","11,16%",🟠 Acima da média,4.79,Etanol
POSTO TREVAO II,MG,LAVRAS,"Rua BR 265  KM 1595,  JARDIM SUM","11,16%",🟠 Acima da média,4.79,Etanol
R P LOPES FONSECA,SP,SANTOS,"Praça CORACAO DE MARIA, 23","11,16%",🟠 Acima da média,4.79,Etanol
AUTO POSTO ARQUIPELAGO,SP,CARAGUATATUBA,"Rua AV.  MARGINAL DOIS  35, S/N","11,16%",🟠 Acima da média,4.789999999999999,Etanol
POSTO ALPA VII PARA-SHELL,MG,IBIA,Rua AV BHARTOLOMEU R DE PAIVA 68,"11,16%",🟠 Acima da média,4.789999999999999,Etanol
POSTO BOAVENTURA,CE,FORTALEZA,"Rua AV.  GODOFREDO MACIEL, 6060,","11,14%",🟠 Acima da média,6.91,Gasolina Comum
INDUSTRIAL,SE,NOSSA SENHORA DO SOCORRO,"Área R 8  710,  DIST. INDUAT. NO","11,02%",🟠 Acima da média,6.902777777777778,Gasolina Comum
POSTO CANADA,CE,FORTALEZA,"Rua AV.  TREZE DE MAIO 980, S/N","10,98%",🟠 Acima da média,6.9,Gasolina Comum
POSTO IMBOASSICA COMERCIO E SER,RJ,MACAE,"Rua ROD AMARAL PEIXOTO KM 164,7,","10,98%",🟠 Acima da média,6.9,Gasolina Comum
