Nome EC,UF EC,Cidade EC,Logradouro EC,Desvio de Preço (%),Blacklist,Preço por Litro,Mercadoria
POSTO MOREIRA,GO,VILA BOA,"Rua ROD BR 20 KM 87, S/N","2,13%",✅ Dentro da média,6.35,Gasolina Comum
POSTO RAMOS,PI,IPIRANGA DO PIAUI,"Rua RODOVIA BR 316 KM 260 S/N, S","2,13%",✅ Dentro da média,6.35,Gasolina Comum
POSTO SAO JOAO,RJ,MACAE,"Rua R JOSE AGUIAR FRANCO 270, S/","2,13%",✅ Dentro da média,6.35,Gasolina Comum
POSTO PIONEIRO,CE,MARACANAU,"Rua ROD.  ANEL VIARIO S/N, S/N","2,11%",✅ Dentro da média,6.07,Diesel
AUTO POSTO DA SINHA,SP,TAUBATE,Rua AV.  CHARLES SCHNNEIDER N 20,"2,11%",✅ Dentro da média,4.4,Etanol
POSTO PARAISO DE MINAS GERAIS,MG,SAO SEBASTIAO DO PARAISO,"Rua RD BR491 KL 3 3001, S/N","2,11%",✅ Dentro da média,4.4,Etanol
POSTO CONFIANCA,CE,FORTALEZA,"Rua AV TREZE DE MAIO 233, S/N","2,05%",✅ Dentro da média,6.3447891929099995,Gasolina Comum
POSTO PRETOLINE,DF,BRASILIA,"Rua Q QI 1, 79","2,02%",✅ Dentro da média,6.342703417602995,Gasolina Comum
P.CACIQUE 14,PI,TERESINA,"Avenida DEPUTADO PAULO FERRAZ, 1","1,98%",✅ Dentro da média,6.34047921799253,Gasolina Comum
POSTO VILA,CE,FORTALEZA,"Rua AV DEDE BRASIL 1150, S/N","1,97%",✅ Dentro da média,6.34,Gasolina Comum
POSTO SAO CRISTOVAO,CE,FORTALEZA,"Rua ROD BR 116 KM 15, S/N","1,96%",✅ Dentro da média,6.3395170629002555,Gasolina Comum
POSTO PIONEIRO,CE,FORTALEZA,"Rua AV A 855 3 ETAPA, S/N","1,94%",✅ Dentro da média,5.991219120011695,Diesel S10
MM PETROLEO,CE,MARACANAU,"Avenida RADIALISTA JOAO RAMOS, 3","1,92%",✅ Dentro da média,5.990597806608844,Diesel S10
POSTO MARINA,CE,FORTALEZA,"Rua AV. PRES CASTELO BRANCO 240,","1,92%",✅ Dentro da média,6.336488670575187,Gasolina Comum
POSTO DESEMBARGADOR M-SHELL,CE,FORTALEZA,"Rua RUA CAROLINA SUCUPIRA, S/N","1,91%",✅ Dentro da média,5.990000000000001,Diesel S10
REDE CEARA OUTLET,CE,CAUCAIA,"Área ROD. BR 020, KM 14,5, 6354,","1,91%",✅ Dentro da média,5.990000000000001,Diesel S10
AUTO POSTO 101,RN,CANGUARETAMA,"Rua BR 101 SN KM 6970, SN, S/N","1,91%",✅ Dentro da média,5.99,Diesel S10
AUTO POSTO TIGRAO,CE,FORTALEZA,"Rua BR 116 KM 12    2928, S/N","1,91%",✅ Dentro da média,5.99,Diesel S10
POSTO ABC,MG,SAO SEBASTIAO DO PARAISO,"Área ROD BR 491, 100 A, S/N","1,91%",✅ Dentro da média,5.99,Diesel S10
POSTO ABN,CE,FORTALEZA,"Rua AV CESAR CALS 97, S/N","1,91%",✅ Dentro da média,5.99,Diesel S10
POSTO HOMERO,PI,TERESINA,"Avenida DOUTOR NICANOR BARRETO,","1,91%",✅ Dentro da média,5.99,Diesel S10
POSTO MONTEZUMA V,CE,FORTALEZA,"Rua RUA GRACA ARANHA 150, S/N","1,91%",✅ Dentro da média,5.99,Diesel S10
POSTO RESENDE,RJ,RESENDE,"Rua AV SATURNINO BRAGA, 212, S/N","1,91%",✅ Dentro da média,5.99,Diesel S10
POSTO SAO JOAO,CE,EUSEBIO,"Rua ROD CE040  QLM05 SN, S/N","1,91%",✅ Dentro da média,5.99,Diesel S10
POSTO BOAVENTURA,CE,FORTALEZA,"Rua AV.  GODOFREDO MACIEL, 6060,","1,91%",✅ Dentro da média,5.989999999999999,Diesel S10
SERVICAR SA,PE,JABOATAO DOS GUARARAPES,"Rua AV.  ARMINDO MOURA,461, S/N","1,91%",✅ Dentro da média,5.989999999999999,Diesel S10
POSTO QUERENCIA-SHELL,PR,SARANDI,"Rua AV.  ADEMAR BORNIA  841, S/N","1,89%",✅ Dentro da média,4.390771421116519,Etanol
POSTO OLD CAR PARA-SHELL,CE,FORTALEZA,"Rua RUA CARAPINIMA 2250, S/N","1,89%",✅ Dentro da média,6.334866392600206,Gasolina Comum
POSTO BEZERRA DE MENEZ,CE,FORTALEZA,"Rua AV.  BEZERRA DE MENEZES 216,","1,89%",✅ Dentro da média,6.334678772698809,Gasolina Comum
POSTO FREIRE,MG,UBERABA,"Área PC DOUTOR THOMAZ ULHOA, 500","1,89%",✅ Dentro da média,4.390508133208387,Etanol
POSTO JABURUNA,CE,SOBRAL,"Área ROD BR 222 232, S/N","1,89%",✅ Dentro da média,6.334618225463946,Gasolina Comum
AUTO POSTO 2000,MG,UBERABA,"Rua AVENIDA DEPUTADO JOSE MARCU,","1,87%",✅ Dentro da média,4.390000000000001,Etanol
AUTO POSTO KAKOGAWA,PR,MARINGA,"Rua AV. AMERICO BELAY N 1676, S/","1,87%",✅ Dentro da média,4.390000000000001,Etanol
BARE AUTO POSTO LTDA,SP,SAO SEBASTIAO,"Rua R SEBASTIANA LEITE BUENO, S/","1,87%",✅ Dentro da média,4.390000000000001,Etanol
POSTO CORCOVADO,PR,MARINGA,"Rua AV  PEDRO TAQUES, S/N","1,87%",✅ Dentro da média,4.390000000000001,Etanol
POSTO SALLES LTDA,SP,SAO SEBASTIAO,"Rua AV GUARDA MOR LOBO VIANA, 13","1,87%",✅ Dentro da média,4.390000000000001,Etanol
POSTO TREVO CARAGUA,SP,CARAGUATATUBA,"Rua PC PRIMEIRO CENTENARIO 60, S","1,87%",✅ Dentro da média,4.390000000000001,Etanol
......,SP,CARAGUATATUBA,"Área Avenida Miguel Varlez, 401,","1,87%",✅ Dentro da média,4.39,Etanol
AE RODRIGUES GOMES,PR,MARINGA,AV MANDACARU 1275,"1,87%",✅ Dentro da média,4.39,Etanol
AEROCAR COMERCIO VAREJISTA DE,SP,GUARULHOS,"Rua RUA CACHOEIRA, S/N","1,87%",✅ Dentro da média,4.39,Etanol
AUTO P NOVA GERACAO,SP,SAO JOSE DOS CAMPOS,"Rua AV.  NAIR TOLEDO DE MIRA, 43","1,87%",✅ Dentro da média,4.39,Etanol
AUTO POSTO ASA DELTA,SP,CARAGUATATUBA,Rua R BENEDITO R DOS SANTOS FILH,"1,87%",✅ Dentro da média,4.39,Etanol
AUTO POSTO BCA LUIZIANA LTDA,PR,MARINGA,"Área AVENIDA MANDACARU, 935, S/N","1,87%",✅ Dentro da média,4.39,Etanol
AUTO POSTO FLEXEIRA,SP,CARAGUATATUBA,"Rua AV.  JOSE HERCULANO 7167, S/","1,87%",✅ Dentro da média,4.39,Etanol
AUTO POSTO MESQUITA LTDA,SP,CAMPINAS,"Avenida JULIO MESQUITA, 990","1,87%",✅ Dentro da média,4.39,Etanol
AUTO POSTO PIRAPORINHA SOLIDAO,SP,DIADEMA,"Rua AV PIRAPORINHA 1461, S/N","1,87%",✅ Dentro da média,4.39,Etanol
AUTO POSTO PRAIA DA EN,SP,SAO PAULO,Área AV VEREADOR EMILIO GRANATO,"1,87%",✅ Dentro da média,4.39,Etanol
AUTO POSTO SS NOVA MAUA,SP,SANTO ANDRE,Área R GIOVANNI BATTISTA PIRELLI,"1,87%",✅ Dentro da média,4.39,Etanol
AUTO POSTO VILA NOVA,MG,CATAGUASES,"Rua FRANCISCO VALENTE, 22","1,87%",✅ Dentro da média,4.39,Etanol
CENTRO AUTOMOTIVO BAP RODOANEL,SP,MAUA,"Avenida DOS ESTADOS, 10300","1,87%",✅ Dentro da média,4.39,Etanol
CENTRO AUTOMOTIVO LUIZ XII LTDA,SP,GUARULHOS,"Rua AV SALGADO FILHO 1595, S/N","1,87%",✅ Dentro da média,4.39,Etanol
ESTACAO COMERCIO DE COMBUSTIVEI,PR,ARAPONGAS,"Rua AVENIDA  ARAPONGAS, S/N","1,87%",✅ Dentro da média,4.39,Etanol
NOVO GUARUJA AUTO POSTO LTDA,SP,GUARUJA,Área R MARIA ALZIRA DA CONCEICAO,"1,87%",✅ Dentro da média,4.39,Etanol
PAULO BORGES COMERCIO DE COMBUST,SP,ITUVERAVA,"Área AVENIDA DOUTOR PAULO BORGE,","1,87%",✅ Dentro da média,4.39,Etanol
POSTO BCA LUIZIANA,PR,MARINGA,"Área AV.  PEDRO TAQUES,2041, S/N","1,87%",✅ Dentro da média,4.39,Etanol
POSTO CATEDRAL-SHELL,PR,MARINGA,"Rua AV CERRO AZUL 7, S/N","1,87%",✅ Dentro da média,4.39,Etanol
POSTO CITY AMERICA,SP,SAO PAULO,Rua AV.  OTAVIANO ALVES DE LIM 2,"1,87%",✅ Dentro da média,4.39,Etanol
POSTO CPA 2,PR,MARINGA,Área Avenida Prefeito Sincler Sa,"1,87%",✅ Dentro da média,4.39,Etanol
POSTO OASIS,PR,MARINGA,AV PARANA 562,"1,87%",✅ Dentro da média,4.39,Etanol
POSTO OSCAR,MG,UBERABA,"Área AV GUILHERME FERREIRA 1330,","1,87%",✅ Dentro da média,4.39,Etanol
POSTO PALMA,SP,ORLANDIA,"Rua R.UM 700, S/N","1,87%",✅ Dentro da média,4.39,Etanol
POSTO SAMEIRO,PR,MARINGA,"Rua AV PARANA 1145, S/N","1,87%",✅ Dentro da média,4.39,Etanol
POSTO SANTO ANTONIO,SP,CARAGUATATUBA,"Área AV MIGUEL VARLEZ 700, S/N","1,87%",✅ Dentro da média,4.39,Etanol
POSTO SAO JOAQUIM,SP,SAO JOAQUIM DA BARRA,R ALAGOAS 390,"1,87%",✅ Dentro da média,4.39,Etanol
POSTO SERRANO,MG,SERRA DO SALITRE,"Avenida JOAO JOSE MACHADO, 790","1,87%",✅ Dentro da média,4.39,Etanol
POSTO TIGRE DO VALE//ESSO,SP,MOGI DAS CRUZES,"Rua ROD.  MOGI-DUTRA 600 KM 1, S","1,87%",✅ Dentro da média,4.39,Etanol
POSTO TRABUCO,PR,MARINGA,"Rua AV PARANA 1661, S/N","1,87%",✅ Dentro da média,4.39,Etanol
POSTO UNIDO,PR,MARINGA,"Rua AV BRASIL 7442, S/N","1,87%",✅ Dentro da média,4.39,Etanol
S C S COMERCIO DE COMBUSTIVEIS,PR,ARAPONGAS,"Rua AV.  ARAPONGAS 941, S/N","1,87%",✅ Dentro da média,4.39,Etanol
AUTO POSTO 2000,MG,CAMPOS ALTOS,Área AV NILTON FERREIRA DE PAIV,"1,87%",✅ Dentro da média,4.389999999999999,Etanol
AUTO POSTOJOTI,SP,CARAGUATATUBA,"Área AV PRES CAMPOS SALLES 450,","1,87%",✅ Dentro da média,4.389999999999999,Etanol
POSTO FORMULA 1,PR,MARINGA,"Rua PC.  LUIZ GONZAGA 36, S/N","1,87%",✅ Dentro da média,4.389999999999999,Etanol
POSTO NEVADA,SP,CARAPICUIBA,"Rua AV DEP EMILIO CARLOS 335, S/","1,87%",✅ Dentro da média,4.389999999999999,Etanol
AUTO POSTO JOTI,SP,CARAGUATATUBA,"Rua AV PRES CAMPOS SALLES 450, S","1,86%",✅ Dentro da média,4.389355202640414,Etanol
REDE MONTE CARLO,SP,GUARA,MARG EXPEDICIONARIOS D 350,"1,85%",✅ Dentro da média,4.3889863362419295,Etanol
JEC COMERCIO DE COMBUSTIVEL LTDA,CE,FORTALEZA,"Área AVENIDA PRES CASTELO BRANC,","1,81%",✅ Dentro da média,6.330000000000001,Gasolina Comum
POSTO MODELO ENCRUZIL-SHELL,CE,FORTALEZA,"Avenida TREZE DE MAIO, 1488","1,81%",✅ Dentro da média,6.33,Gasolina Comum
P.CACIQUE 11,PI,TERESINA,"Avenida DEPUTADO PAULO FERRAZ, 2","1,78%",✅ Dentro da média,6.328227911646586,Gasolina Comum
P.CACIQUE 15,PI,TERESINA,"Avenida MARANHAO, 3399","1,78%",✅ Dentro da média,6.327976880246461,Gasolina Comum
NARCISO AUTOPOSTO,ES,VILA VELHA,"Rua R SOBREIRO 395, S/N","1,78%",✅ Dentro da média,6.05,Diesel
AUTO POSTO TRIVELA 2 LTDA,ES,SERRA,"Área RUA JOSE RONALDO BARBOSA, 8","1,77%",✅ Dentro da média,6.327410960356158,Gasolina Comum
POSTO 3 D ANTA,RJ,ANTA,"Rua ROD BR 393 KM 37, S/N","1,74%",✅ Dentro da média,5.98,Diesel S10
L.H.S.G COM COMBUSTIVEIS,PR,MARINGA,"Rua AV COLOMBO, S/N","1,64%",✅ Dentro da média,4.380000000000001,Etanol
AUTO POSTO SHOP CAR IV,MA,IMPERATRIZ,"Rua R RIO GRANDE DO NORTE, 436","1,63%",✅ Dentro da média,6.31849805710424,Gasolina Comum
POSTO ANEL VIARIO,CE,JUAZEIRO DO NORTE,"Avenida DO AGRICULTOR, 1575","1,61%",✅ Dentro da média,6.040000000000001,Diesel
POSTO FREITAS,CE,ACARAU,Rua AV. VOLUNTARIO DA PATRIA 230,"1,57%",✅ Dentro da média,5.970000000000001,Diesel S10
POSTO MAGNOLIA,MA,MARANHAO,"Rua BR 316 KM 265 S/N, S/N","1,57%",✅ Dentro da média,5.97,Diesel S10
POSTO SETE CARIOCA,CE,HORIZONTE,ROD BR 116 42,"1,57%",✅ Dentro da média,5.97,Diesel S10
POSTO VILA,CE,FORTALEZA,"Rua AV DOS EXPEDICIONARIOS 9977,","1,57%",✅ Dentro da média,5.97,Diesel S10
POSTO SAO VICENTE BARR,RJ,BARRA DO PIRAI,"Rua AV PREF ARTUR DA COSTA 988,","1,51%",✅ Dentro da média,6.3114443625644805,Gasolina Comum
POSTO CAUCAIA,CE,CAUCAIA,"Rua R CEL CORREIA 1701, S/N","1,46%",✅ Dentro da média,6.308422322887274,Gasolina Comum
POSTO PARIS,MG,UBERLANDIA,Rua PC.  CLARINDA DE FREITAS 375,"1,46%",✅ Dentro da média,4.3719651927720875,Etanol
LUA PETROLEO-SHELL,CE,EUSEBIO,ROD CE 40 6,"1,44%",✅ Dentro da média,6.3069856693084345,Gasolina Comum
POSTO CEARA,CE,MARACANAU,Área RUA VICENTE ALVES DE PAULA,"1,44%",✅ Dentro da média,6.306786407766991,Gasolina Comum
POSTO SANTA INES,CE,MARACANAU,"Rua DR MENDEL STEINBRUCH, S/N","1,43%",✅ Dentro da média,6.306042659619649,Gasolina Comum
PEISINO AUTO POSTO E SERVICOS L,ES,VILA VELHA,"Rua AVENIDA CARLOS LINDENBERG, 5","1,41%",✅ Dentro da média,6.305303189624956,Gasolina Comum
AUTO POSTO PE DE CEDRO,MS,SIDROLANDIA,Rua AV DURVALINO DOS SANTOS 2080,"1,41%",✅ Dentro da média,4.37,Etanol
MEARIM DERIVADOS DE PETROLEO LT,MA,ARARI,"Rua RODOVIA BR 222 KM 30 S/N, S/","1,38%",✅ Dentro da média,6.303077634270025,Gasolina Comum
CAJUEIRO COMERCIO DE COMBUSTIVEI,PI,FLORIANO,"Rua RD 230, S/N","1,33%",✅ Dentro da média,6.3,Gasolina Comum
CARIRI COMBUSTIVEIS,CE,JUAZEIRO DO NORTE,"Área AVENIDA GOV VIRGILIO TAVOR,","1,33%",✅ Dentro da média,6.3,Gasolina Comum
LEAL XI COMERCIO DE PETROLEO LTD,CE,MARACANAU,Área Avenida Radialista João Ram,"1,33%",✅ Dentro da média,6.3,Gasolina Comum
POSTO IMACULADA CONCEI,CE,JUAZEIRO DO NORTE,"Rua AV CASTELO BRANCO 2215, S/N","1,33%",✅ Dentro da média,6.3,Gasolina Comum
POSTO PETROBRAS,CE,CRATEUS,"Rua R FR VIDAL DA PENHA 1388, S/","1,33%",✅ Dentro da média,6.3,Gasolina Comum
POSTO TALISMA,CE,CARIRIACU,Rua R JOSE JOAQUIM DE SANTANA 13,"1,33%",✅ Dentro da média,6.3,Gasolina Comum
POSTO VIA SUL - TEXACO,AL,SAO MIGUEL DOS CAMPOS,Rua AV.JOAO SORIANO BOMFIM SN KM,"1,33%",✅ Dentro da média,6.3,Gasolina Comum
CAMINHO DO SOL PARA-SHELL,CE,FORTALEZA,"Rua RUA CEL ERNESTO MATOS, 582,","1,33%",✅ Dentro da média,6.299999999999999,Gasolina Comum
POSTO IMACULADA CONCEI,CE,JUAZEIRO DO NORTE,"Rua AV CASTELO BRANCO 2215, S/N","1,27%",✅ Dentro da média,5.951864121280179,Diesel S10
POSTO VILA,CE,FORTALEZA,"Rua AV DOS EXPEDICIONARIOS 9977,","1,24%",✅ Dentro da média,6.29437166567872,Gasolina Comum
LUA PETROLEO-SHELL,CE,EUSEBIO,ROD CE 40 6,"1,23%",✅ Dentro da média,5.95,Diesel S10
POSTO BOAVENTURA II,CE,FORTALEZA,"Rua AV JOSE BASTOS N3250, S/N","1,23%",✅ Dentro da média,5.95,Diesel S10
AUTO POSTO PARAISO,SP,SAO VICENTE,Rua AV CAP LUIS HORNEAUX MOURA 8,"1,21%",✅ Dentro da média,4.361273882687403,Etanol
POSTO SANTA EDWIRGE III,CE,FORTALEZA,"Rua RUA CONEGO DE CASTRO 4670, S","1,20%",✅ Dentro da média,6.292092053270892,Gasolina Comum
POSTO SOL NASCENTE,RJ,PINHEIRAL,"Rua AV NEWTON PENA BOTELHO, S/N","1,18%",✅ Dentro da média,6.290720900671872,Gasolina Comum
POSTO PARATY,SP,ALTINOPOLIS,"Rua ROD SP 351 KM 24.2, S/N","1,18%",✅ Dentro da média,4.36,Etanol
AUTO POSTO ESTRELA DE FRIBURGO,RJ,NOVA FRIBURGO,Área R. VER JOSE MARTINS DA COST,"1,17%",✅ Dentro da média,6.290000000000001,Gasolina Comum
POSTO PAGUE MENOS,CE,ANTONINA DO NORTE,"Rua AV NELITO MENDES, S/N","1,17%",✅ Dentro da média,6.290000000000001,Gasolina Comum
POSTO TIGRAO,RJ,CAMPOS DOS GOYTACAZES,"Rua ROD BR 101 KM 80,5, S/N","1,17%",✅ Dentro da média,6.290000000000001,Gasolina Comum
AUTO POSTO CINESE,SP,GUARUJA,"Rua AV. CD AUREA GONZALES 570, S","1,17%",✅ Dentro da média,6.29,Gasolina Comum
AUTO POSTO EXTRA,MA,IMPERATRIZ,"Rua R SOUSA LIMA, S/N","1,17%",✅ Dentro da média,6.29,Gasolina Comum
AUTO POSTO PAPAI DE MAUA LTDA,SP,MAUA,"Rua AV BR MAUA 2711, S/N","1,17%",✅ Dentro da média,6.29,Gasolina Comum
AUTO POSTO PIVA,MG,CAXAMBU,"Rua ROD BR  267, S/N","1,17%",✅ Dentro da média,6.29,Gasolina Comum
AUTO POSTO VILA NOVA,SP,CUBATAO,"Rua AV 9 DE ABRIL 2916, S/N","1,17%",✅ Dentro da média,6.29,Gasolina Comum
POSTO CARVALHO,PI,TERESINA,"Rua R MAGALHAES FILHO 2166, S/N","1,17%",✅ Dentro da média,6.29,Gasolina Comum
POSTO KID DOLAR,RJ,SILVA JARDIM,"Rua ROD BR 101 KM 236, S/N","1,17%",✅ Dentro da média,6.29,Gasolina Comum
POSTO LUC DE PADUA,RJ,SANTO ANTONIO DE PADUA,Rua RODOVIA RJ 116 KM 0 ESTRADA,"1,17%",✅ Dentro da média,6.29,Gasolina Comum
POSTO MARTINEZ 3,PI,ITAUEIRA,"Rua R. JUSSELINO KUBECHEK SN, S/","1,17%",✅ Dentro da média,6.29,Gasolina Comum
POSTO NOVO PINHEIRAL,RJ,PINHEIRAL,"Rua AV NILTON PENNA BOTELHO 738,","1,17%",✅ Dentro da média,6.29,Gasolina Comum
POSTO PUMA,RJ,SAO PEDRO DA ALDEIA,"Rua ROD RJ 140, S/N","1,17%",✅ Dentro da média,6.29,Gasolina Comum
POSTO QUATRO RODAS,MA,IMPERATRIZ,"Área AVENIDA BERNARDO SAYAO, 132","1,17%",✅ Dentro da média,6.29,Gasolina Comum
POSTO REFORCO II,SE,UMBAUBA,"Rua ROD BR 101 KM 179,5 SN, S/N","1,17%",✅ Dentro da média,6.29,Gasolina Comum
POSTO SALLES LTDA,SP,SAO SEBASTIAO,"Rua AV GUARDA MOR LOBO VIANA, 13","1,17%",✅ Dentro da média,6.29,Gasolina Comum
POSTO SANTANA,BA,CASA NOVA,RODOVIA BR 235 SN,"1,17%",✅ Dentro da média,6.29,Gasolina Comum
POSTO SANTO ANTONIO,MG,COROMANDEL,Rua R CLESIO EUSTAQUIO MIGUELETO,"1,17%",✅ Dentro da média,6.29,Gasolina Comum
POSTO SEABRA,BA,SEABRA,"Rua ROD BR 242 KM 271,5, S/N","1,17%",✅ Dentro da média,6.29,Gasolina Comum
POSTO SERVICO CIDADE,PE,CARPINA,"Rua AV.  AGAMENON MAGALHAES 139,","1,17%",✅ Dentro da média,6.29,Gasolina Comum
POSTO TREVO,PI,FLORIANO,"Rua AV DIRCEU ARCO VERDE 500, S/","1,17%",✅ Dentro da média,6.29,Gasolina Comum
POSTO VEU DAS NOIVAS,RJ,NOVA FRIBURGO,"Área RUA SEBASTIAO MARTINS, 349,","1,17%",✅ Dentro da média,6.29,Gasolina Comum
POSTO VIA LAGOS,RJ,SAO PEDRO DA ALDEIA,ROD AMARAL PEIXOTO,"1,17%",✅ Dentro da média,6.29,Gasolina Comum
AUTO POSTO JUCAS LTDA,CE,JUCAS,Área AV ORMECINDA CORREIA LEITE,"1,17%",✅ Dentro da média,6.289999999999999,Gasolina Comum
POSTO CACIQUE 23,PI,TERESINA,"Área RODOVIA BR 343 SN, S/N","1,17%",✅ Dentro da média,6.289999999999999,Gasolina Comum
POSTO PIRIPIRI,PI,PIRIPIRI,"Avenida ADERSON FERREIRA, 2390","1,17%",✅ Dentro da média,6.289999999999999,Gasolina Comum
POSTO TABAPOA,CE,CAUCAIA,ROD BR 222,"1,15%",✅ Dentro da média,6.288648605830165,Gasolina Comum
POSTO BELLAS SAO PEDRO DA ALDEI,RJ,SAO PEDRO DA ALDEIA,"Rua RODOVIA RJ-140, S/N","1,14%",✅ Dentro da média,6.288236900546189,Gasolina Comum
AUTO POSTO G4 LTDA,SP,MAUA,"Rua AVENIDA JOAO RAMALHO, 150 4B","1,14%",✅ Dentro da média,4.358207865152172,Etanol
JOCKEY COMERCIO DE COM,CE,FORTALEZA,Rua AVENIDA LINEU MACHADO N 560,"1,06%",✅ Dentro da média,5.94,Diesel S10
POSTO ALBERTO ANDRADE II,AP,MACAPA,"Rua RUA PAULO, 381, S/N","1,03%",✅ Dentro da média,6.281632350375152,Gasolina Comum
DISTRIBUIDORA FENIX,CE,FORTALEZA,"Rua AV JORN TOMAZ COELHO 1878, S","1,03%",✅ Dentro da média,6.281320800485142,Gasolina Comum
POSTO AGULHAS NEGRAS,RJ,RESENDE,"Rua PRACA CONCORDIA,60, S/N","1,02%",✅ Dentro da média,6.281086105675147,Gasolina Comum
POSTO. SAO RAIMUNDO,MA,SANTA LUZIA,"Rua BR222 KM 46 S/N, S/N","1,01%",✅ Dentro da média,6.28014403833231,Gasolina Comum
POSTO SAO CRISTOVAO,SP,SAO PAULO,"Rua AV BUCAR NETO 574, S/N","1,01%",✅ Dentro da média,6.280000000000001,Gasolina Comum
Auto Posto Verdurao,MG,COROMANDEL,Área Rua Doutor Ermiro Rodrigues,"1,01%",✅ Dentro da média,6.28,Gasolina Comum
AUTO POSTO BRASIL,RJ,VOLTA REDONDA,"Rua RUA QUATRO, S/N","0,95%",✅ Dentro da média,6.2765742546276675,Gasolina Comum
AUTO POSTO PEIROPOLIS,MG,UBERABA,"Área PC DOUTOR HENRIQUE KRUGER,","0,95%",✅ Dentro da média,4.35,Etanol
POSTO OCEANO,CE,FORTALEZA,"Rua AV FRANCISCO SA 2815, S/N","0,94%",✅ Dentro da média,6,Diesel
POSTO MAGNOLIA,MA,MARANHAO,"Rua BR 316 KM 265 S/N, S/N","0,93%",✅ Dentro da média,6.275285084791027,Gasolina Comum
POSTO CASA VERDE,MS,NOVA ANDRADINA,"Rua ROD BR 267 SN, S/N","0,92%",✅ Dentro da média,4.349074953541193,Etanol
POSTO FLORESTAL,RN,ACU,"Rua ROD BR 304 KM 110,2, S/N","0,92%",✅ Dentro da média,5.931362720966659,Diesel S10
ECODRIVE,MA,IMPERATRIZ,"Rodovia ROD BR010, NA","0,90%",✅ Dentro da média,6.273490750572849,Gasolina Comum
POSTO CONFIANCA I,MA,PRESIDENTE DUTRA,"Área AV JOSE OLAVO SAMPAIO, 60,","0,90%",✅ Dentro da média,6.273037872683321,Gasolina Comum
POSTO PERIMETRAL,CE,FORTALEZA,"Rua R. SEN ALVARO ADOLFO 1789, S","0,88%",✅ Dentro da média,6.2719567538707945,Gasolina Comum
DIGO S AUTO POSTO II,PR,MARINGA,Área AV DONA SOPHIA RASGULAEFF 3,"0,85%",✅ Dentro da média,4.345877843087146,Etanol
POSTO NOSSA SENHORA DA GUIA,PI,FLORIANO,"Rua AVENIDA CALISTO LOBO 770, S/","0,85%",✅ Dentro da média,6.2700000000000005,Gasolina Comum
POSTO VAQUEIRO,CE,EUSEBIO,Rua RODOVIA  ANEL VIARIO S/N KM,"0,85%",✅ Dentro da média,6.27,Gasolina Comum
SP SOL POENTE,CE,FORTALEZA,"Área ROD ESTRUTURANTE CE, S/N","0,85%",✅ Dentro da média,6.27,Gasolina Comum
POSTO PIONEIRO,CE,FORTALEZA,"Rua AV A 855 3 ETAPA, S/N","0,84%",✅ Dentro da média,6.269640762801864,Gasolina Comum
POSTO BARBARA,RJ,VOLTA REDONDA,"Rua VIA SERGIO BRAGA 1070, S/N","0,83%",✅ Dentro da média,6.269220588235294,Gasolina Comum
POSTO PECEM,CE,SAO GONCALO DO AMARANTE,"Rua ROD CE 121, S/N","0,83%",✅ Dentro da média,6.2687769339456025,Gasolina Comum
POSTO HAVAI 2,CE,TAUA,Rua AV CHERMONT ALVES DE OLV 897,"0,78%",✅ Dentro da média,6.266136062825377,Gasolina Comum
POSTO VILA,CE,FORTALEZA,"Rua AV DOS EXPEDICIONARIOS 9977,","0,78%",✅ Dentro da média,5.990616446800641,Diesel
AUTO POSTO TIGRAO,CE,FORTALEZA,"Rua BR 116 KM 12    2928, S/N","0,77%",✅ Dentro da média,5.99,Diesel
FCNX CONBUSTIVEIS,MA,CAXIAS,"Rua ROD BR-316 KM 552, S/N","0,77%",✅ Dentro da média,5.99,Diesel
MM PETROLEO,CE,MARACANAU,"Avenida RADIALISTA JOAO RAMOS, 3","0,77%",✅ Dentro da média,5.99,Diesel
POSTO ATLANTICO,CE,FORTALEZA,"Rua AV.  ABOLICAO 3395, S/N","0,77%",✅ Dentro da média,5.99,Diesel
POSTO HOMERO,PI,TERESINA,"Avenida DOUTOR NICANOR BARRETO,","0,77%",✅ Dentro da média,5.99,Diesel
POSTO MONTEZUMA V,CE,FORTALEZA,"Rua RUA GRACA ARANHA 150, S/N","0,77%",✅ Dentro da média,5.99,Diesel
POSTO PIONEIRO,CE,FORTALEZA,"Rua AV A 855 3 ETAPA, S/N","0,77%",✅ Dentro da média,5.99,Diesel
REDE CEARA OUTLET,CE,CAUCAIA,"Área ROD. BR 020, KM 14,5, 6354,","0,77%",✅ Dentro da média,5.99,Diesel
RVM DO SUDOESTE -ESSO,MG,PASSOS,Rua AV. CDOR FRANCISCO A MAIA 43,"0,77%",✅ Dentro da média,5.99,Diesel
POSTO IMACULADA CONCEI,CE,JUAZEIRO DO NORTE,"Rua AV CASTELO BRANCO 2215, S/N","0,77%",✅ Dentro da média,5.989999999999999,Diesel
AUTO POSTO G4 LTDA,SP,MAUA,"Rua AVENIDA JOAO RAMALHO, 150 4B","0,76%",✅ Dentro da média,6.264912280701755,Gasolina Comum
AUTO POSTO CINESE,SP,GUARUJA,"Rua AV. CD AUREA GONZALES 570, S","0,76%",✅ Dentro da média,4.342093473005638,Etanol
POSTO DALLAS,CE,FORTALEZA,"Rua R: ALVARO DE ALENCAR, 787, S","0,75%",✅ Dentro da média,6.264298868982084,Gasolina Comum
AUTO POSTO DOIS IRMAOS,CE,NOVA OLINDA,"Rua SITO JACUZ CE 292 SN, S/N","0,73%",✅ Dentro da média,6.262668826314478,Gasolina Comum
POSTO VIA OESTE,PE,SALGUEIRO,Rua R JOAO VERA DE SIQUEIRA 1720,"0,72%",✅ Dentro da média,5.92,Diesel S10
AUTO POSTO CERRADO,MS,DOURADOS,"Rua AV MARCELINO PIRES 2508, S/N","0,71%",✅ Dentro da média,4.34,Etanol
AUTO POSTO GUARANI,SP,SAO VICENTE,"Rua GUARANI, 11","0,71%",✅ Dentro da média,4.34,Etanol
AUTO POSTO POROROCA XVIII,MS,CAMPO GRANDE,"Área Avenida Tres Barras, 3384,","0,71%",✅ Dentro da média,4.34,Etanol
RIVA BEACH AUTO POSTO LTDA,SP,BERTIOGA,"Rua APROVADA RSL MOD VIVEIROS, 2","0,71%",✅ Dentro da média,4.34,Etanol
POSTO DE COMBUSTIVEL SAO CRISTOV,CE,CRATEUS,Rua AV  BENONY MOURAO FILHO 1030,"0,69%",✅ Dentro da média,6.26,Gasolina Comum
POSTO KUNG FU,MG,UBERLANDIA,Rua R FLORESTANO DE MACEDO TIBER,"0,65%",✅ Dentro da média,4.337232193463064,Etanol
POSTO SAO DOMINGOS,CE,FORTALEZA,"Rua AV MR HULL 4000, S/N","0,64%",✅ Dentro da média,6.257250639386188,Gasolina Comum
POSTO PEDRAS,CE,EUSEBIO,"Rua RODOVIA BR 116, 7844 KM 16,","0,62%",✅ Dentro da média,6.255892556416303,Gasolina Comum
POSTO CACIQUE 17,PI,TERESINA,"Avenida PREFEITO WALL FERRAZ, 15","0,55%",✅ Dentro da média,6.25146669154693,Gasolina Comum
POSTO KARIRI,CE,JUAZEIRO DO NORTE,"Rua AV.  CASTELO BRANCO,253, S/N","0,54%",✅ Dentro da média,6.251117847669573,Gasolina Comum
POSTO ABN,CE,AQUIRAZ,"Rua CE 040 KM 26, S/N","0,54%",✅ Dentro da média,6.251083172824373,Gasolina Comum
AUTO POSTO RJ SAO PEDRO,RJ,SAO PEDRO DA ALDEIA,"Rua ROD RJ 140 KM 51 8, S/N","0,52%",✅ Dentro da média,6.25,Gasolina Comum
MASTERGAS,SP,SAO PAULO,"Rua ROD BR 230 KM 31 SN ESTRADA,","0,52%",✅ Dentro da média,6.25,Gasolina Comum
MENDES DISTRIBUIDORA,CE,MARANGUAPE,"Rua AV DR STENIO GOMES SN, S/N","0,52%",✅ Dentro da média,6.25,Gasolina Comum
POSTO ABN,CE,AQUIRAZ,Rua 2OD CE 040 40 KM 38 CAJ DO M,"0,52%",✅ Dentro da média,6.25,Gasolina Comum
POSTO ABN,CE,PINDORETAMA,"Rua AV VALEREALBINO 405, S/N","0,52%",✅ Dentro da média,6.25,Gasolina Comum
POSTO LS,CE,FORTALEZA,"Rua SENADOR POMPEU, 1958","0,52%",✅ Dentro da média,6.25,Gasolina Comum
POSTO PRACA GOIANESIA,PA,GOIANESIA DO PARA,"Área AV TANCREDO NEVES, 01, S/N","0,52%",✅ Dentro da média,6.25,Gasolina Comum
SAO DOMINGOS PETROLEO LTDA,MA,BACABAL,"Rua BR 316 KM 357 SN, S/N","0,52%",✅ Dentro da média,6.25,Gasolina Comum
UNIAO COMERCIO DE COMBUSTIVEL,CE,FORTALEZA,"Rua AV BORGES DE MELO 1277, S/N","0,52%",✅ Dentro da média,6.25,Gasolina Comum
D. GUERRA LTDA,PI,SAO RAIMUNDO NONATO,"Área AV CORONEL MILANEZ, 00, S/N","0,52%",✅ Dentro da média,6.249999999999999,Gasolina Comum
POSTO MAGALHAES VI,CE,CAUCAIA,"Área RUA JUACI SAMPAIO PONTES, 3","0,50%",✅ Dentro da média,6.248680555555555,Gasolina Comum
POSTO DE COMBUSTIVEIS ADE,DF,BRASILIA,"Rua ADE CONJUNTO, 16, S/N","0,50%",✅ Dentro da média,6.248506050605061,Gasolina Comum
POSTO AUTO MELO,CE,CAUCAIA,"Rua AV.  AIRTON SENNA 376, S/N","0,50%",✅ Dentro da média,6.2481913027421285,Gasolina Comum
AUTO POSTO 17-SHELL,PR,MARINGA,"Rua AV COLOMBO, 5195, S/N","0,48%",✅ Dentro da média,4.33,Etanol
G10 AUTO POSTO,PR,MARINGA,"Rua ROD.  PR-317 4652 KM 03, S/N","0,48%",✅ Dentro da média,4.33,Etanol
Posto Piloto,PR,MARINGA,"Área Rua Estados Unidos, 555, S/","0,48%",✅ Dentro da média,4.33,Etanol
POSTO UNIVERSIDADE,PR,MARINGA,"Rua AV.  MORANGUEIRA 443, S/N","0,48%",✅ Dentro da média,4.33,Etanol
POSTO 100 POR CENTO,CE,LAVRAS DA MANGABEIRA,"Rua ROD CE 153 KM 250 5, S/N","0,45%",✅ Dentro da média,6.245401755570561,Gasolina Comum
POSTO CACIQUE 41,MA,TIMON,"Área R.  AQUILES LISBOA 47, S/N","0,44%",✅ Dentro da média,6.244485066510499,Gasolina Comum
JOCKEY COMERCIO DE COM,CE,FORTALEZA,Rua AVENIDA LINEU MACHADO N 560,"0,43%",✅ Dentro da média,5.970000000000001,Diesel
POSTO FREITAS,CE,ACARAU,Rua AV. VOLUNTARIO DA PATRIA 230,"0,43%",✅ Dentro da média,5.970000000000001,Diesel
POSTO PBB,CE,TAIBA,Rua RUA CAPITAO INACIO PRATA 300,"0,43%",✅ Dentro da média,5.97,Diesel
AEROPORTO COMBUSTIVEIS,MG,UBERLANDIA,"Rua AV DOM PEDRO SEGUNDO 525, S/","0,41%",✅ Dentro da média,4.327079461933157,Etanol
POSTO SAN LORENZO LTDA,CE,FORTALEZA,"Área R ALMIRANTE RUBIM, S/N","0,40%",✅ Dentro da média,6.242150324125446,Gasolina Comum
POSTO MAGNOLIA,CE,MILAGRES,"Rua ROD BR 116 KM 481, S/N","0,36%",✅ Dentro da média,6.240000000000001,Gasolina Comum
AUTOPOSTO CONFIANCA V,MA,PRESIDENTE DUTRA,"Área AV OTON GONCALVES DE SA, 19","0,36%",✅ Dentro da média,6.24,Gasolina Comum
POSTO SIM,CE,CANINDE,"Rua AV SAO FRANCISCO 1129, S/N","0,36%",✅ Dentro da média,6.24,Gasolina Comum
POSTO AVENIDA,ES,SERRA,"Rua ROD NORTE/SUL, S/N","0,33%",✅ Dentro da média,6.238080922669692,Gasolina Comum
