Nome EC,UF EC,Cidade EC,Logradouro EC,Desvio de Preço (%),Blacklist,Preço por Litro,Mercadoria
LEO COMERCIO DE DERIVADOS DE PE,CE,FORTALEZA,"Rua AVENIDA CEL CARVALHO, S/N","7,35%",✅ Dentro da média,6.6743475343844345,Gasolina Comum
POSTO PIONEIRO,CE,MARACANAU,"Rua ROD.  ANEL VIARIO S/N, S/N","7,33%",✅ Dentro da média,6.673150507741613,Gasolina Comum
IGUEP INCORPORADORA GUEDES PEREI,PE,RECIFE,"Rua RUA BOM PASTOR, 27, S/N","7,32%",✅ Dentro da média,6.672661075104842,Gasolina Comum
POSTO B E M,CE,CAUCAIA,"Área AV ULISSES GUIMARAES 1881,","7,30%",✅ Dentro da média,6.671307066072956,Gasolina Comum
MSL COMERCIO COMBUS,RJ,CAMPOS DOS GOYTACAZES,Rua AVENIDA SETE DE SETEMBRO   2,"7,30%",✅ Dentro da média,6.671292940878062,Gasolina Comum
AUTO POSTO CALUNGA LTD,SP,SAO VICENTE,"Rua AV.  ANTONIO EMMERICK 1445,","7,28%",✅ Dentro da média,6.67,Gasolina Comum
D E D COMERCIO DE DERIVADOS DE P,CE,MARACANAU,"Rua RUA CRISTOVAO DE MELO 51, S/","7,28%",✅ Dentro da média,6.67,Gasolina Comum
POSTO PORTAL DE SUAPE,PE,CABO DE SANTO AGOSTINHO,"Rua ROD.  PE-60 KM 10, S/N","7,28%",✅ Dentro da média,6.67,Gasolina Comum
MOTO MERCANTIL CAMPISTA,RJ,CAMPOS DOS GOYTACAZES,"Rua AVENIDA DR ARTUR BERNARDES,","7,25%",✅ Dentro da média,6.668262946684503,Gasolina Comum
POSTO BEM TE VI,PI,PICOS,"Rua AVENIDA HELVIDIO NUNES, S/N","7,19%",✅ Dentro da média,6.3,Diesel S10
POSTO CEASA,CE,MARACANAU,Rua R MENDEL STREINBRUCH S/  KM4,"7,15%",✅ Dentro da média,6.662164967225055,Gasolina Comum
POSTO STATUS,CE,FORTALEZA,AVENIDA PRES COSTA E SILVA,"7,15%",✅ Dentro da média,6.661999276607289,Gasolina Comum
POSTO LIDER,RJ,CAMPOS DOS GOYTACAZES,Rua AV.  QUINZE DE NOVEMBRO 563/,"7,14%",✅ Dentro da média,6.6613415518491665,Gasolina Comum
AUTO POSTO DOIS IRMAOS,CE,NOVA OLINDA,"Rua SITO JACUZ CE 292 SN, S/N","7,09%",✅ Dentro da média,6.294014702089245,Diesel S10
POSTO ITAPERY,CE,FORTALEZA,"Rua AV. PRES COSTA E SILVA 2721,","7,03%",✅ Dentro da média,6.290643676581713,Diesel S10
POSTO 21,MG,BOA ESPERANCA,"Rua R GODOFREDO MOREIRA 120, S/N","7,02%",✅ Dentro da média,6.290000000000001,Diesel S10
POSTO NATUBA,BA,CICERO DANTAS,"Rua R MARIA DA BATISTA DOS SANT,","7,02%",✅ Dentro da média,6.290000000000001,Diesel S10
CENTER POSTO,CE,SOBRAL,Rua AV. DR ARIMATEIA M E SILVA 4,"7,02%",✅ Dentro da média,6.29,Diesel S10
POSTO BATATEIRAS,CE,CRATO,Rua AV JOAQUIM P BEZERRA MENEZES,"7,02%",✅ Dentro da média,6.29,Diesel S10
POSTO CACIQUE 23,PI,TERESINA,"Área RODOVIA BR 343 SN, S/N","7,02%",✅ Dentro da média,6.29,Diesel S10
POSTO DOIS IRMAOS,PI,PIRACURUCA,"Rua AV.AURELIO BRITO 605, S/N","7,02%",✅ Dentro da média,6.29,Diesel S10
POSTO INDEPENDENCIA,CE,CRATO,"Rua PC JOAO BRIGIDO 1450, S/N","7,02%",✅ Dentro da média,6.29,Diesel S10
POSTO LITORAL,CE,CASCAVEL,"Rua ROD CE 40 KM 47,2, S/N","7,02%",✅ Dentro da média,6.29,Diesel S10
POSTO PAGUE MENOS,CE,ANTONINA DO NORTE,"Rua AV NELITO MENDES, S/N","7,02%",✅ Dentro da média,6.289999999999999,Diesel S10
AUTO POSTO PIRAJA,PI,CANTO DO BURITI,"Rua AV GETULIO VARGAS 780, S/N","6,96%",✅ Dentro da média,6.65,Gasolina Comum
POSTO PRETOLINE,DF,BRASILIA,"Rua Q QI 1, 79","6,94%",✅ Dentro da média,4.608206675466716,Etanol
POSTO PACATUBA,CE,PACATUBA,"Rua AVENIDA MENDEL STEINBRUCH, S","6,92%",✅ Dentro da média,6.647904374213603,Gasolina Comum
JACARE AUTO POSTO LTDA,MG,SAO SEBASTIAO DO PARAISO,"Rua AV OLIVEIRA REZENDE 1016, S/","6,91%",✅ Dentro da média,5.88,Diesel S50
AUTOPOSTO AGUA BRANCA,PI,AGUA BRANCA,"Avenida JOSE MIGUEL, 1557","6,85%",✅ Dentro da média,6.279999999999999,Diesel S10
REDE RPB,SE,SAO CRISTOVAO,Área RUA JOSE CONRADO DE ARAUJO,"6,84%",✅ Dentro da média,6.6427863143280685,Gasolina Comum
POSTO SOUTO BAHIA II,RJ,RIO DAS OSTRAS,Rua ROD AMARAL PEIXOTO KM 150 SN,"6,82%",✅ Dentro da média,6.349999999999999,Diesel
POSTO BOA VIAGEM,SE,NOSSA SENHORA DO SOCORRO,"Rodovia BR 101/3, S/N","6,82%",✅ Dentro da média,6.6413120176405736,Gasolina Comum
PARADA CERTA COM DE COMBUSTIVEIS,PE,RECIFE,"Área ROD BR, S/N","6,81%",✅ Dentro da média,6.640942299709423,Gasolina Comum
POSTOS DISBRAVA,TO,PALMAS,"Rua 106 NORTE ALAMEDA 17 SN, S/N","6,81%",✅ Dentro da média,6.640763358778625,Gasolina Comum
POSTO SAO CRISTOVAO,CE,ITAPIPOCA,Rua AV ANASTACIO BRAGA 4445 RODC,"6,80%",✅ Dentro da média,6.64,Gasolina Comum
POSTO 3 D ANTA,RJ,ANTA,"Rua ROD BR 393 KM 37, S/N","6,80%",✅ Dentro da média,6.63992375142966,Gasolina Comum
POSTO ATLANTICO,ES,VITORIA,"Rua AV.DANTE MICHELINE 4655, S/N","6,80%",✅ Dentro da média,6.6398352214212135,Gasolina Comum
P.CACIQUE 15,PI,TERESINA,"Avenida MARANHAO, 3399","6,78%",✅ Dentro da média,6.347336268574574,Diesel
POSTO IPOJUCA,PE,IPOJUCA,"Rua ROV PE, 60","6,70%",✅ Dentro da média,6.6340156135642845,Gasolina Comum
POSTO SOUSA,PI,BARRO DURO,"Rua AV CEL B DA LUZ 418, S/N","6,67%",✅ Dentro da média,6.269551342439945,Diesel S10
COMERCIO DE COMBUSTIVEIS PETROSO,MA,BALSAS,"Rua AV GOVERNADOR LUIZ ROCHA, 30","6,60%",✅ Dentro da média,6.627898994568359,Gasolina Comum
POSTO SAO FRANCISCO,CE,QUIXADA,"Rua R RODRIGUES JR  947, S/N","6,59%",✅ Dentro da média,6.626862364198866,Gasolina Comum
POSTO GIPAGEL II,PB,PATOS,"Rua CARREIROS, 3","6,54%",✅ Dentro da média,6.261973405061373,Diesel S10
AUTO POSTO DELTA PAQUETA,SP,PRAIA GRANDE,Rua AV. DR ROBERTO DE ALMEIDA 11,"6,52%",✅ Dentro da média,4.590000000000001,Etanol
AUTOPOSTO DELTA PRAIA,SP,PRAIA GRANDE,Rua AV DR ROBERTO DE A VINHAS 39,"6,52%",✅ Dentro da média,4.590000000000001,Etanol
ILHA BELA POSTO DE SERVICOS,SP,ILHABELA,"Rua AV PRCA ISABEL 2727, S/N","6,52%",✅ Dentro da média,4.590000000000001,Etanol
A POSTO NOVOS TEMPOS,SP,PRAIA GRANDE,"Rua AV. PRES KENNEDY 6450, S/N","6,52%",✅ Dentro da média,4.59,Etanol
AUTO POSTO SANTA GIANNA LTDA,SP,FRANCA,"Avenida CHICO JULIO, 2701","6,52%",✅ Dentro da média,4.59,Etanol
POSTO 3D JAMAPARA,RJ,JAMAPARA,"Rua AV  COTRIL, S/N","6,52%",✅ Dentro da média,4.59,Etanol
POSTO ALPA 11,MG,ARAXA,"Avenida WILSON BORGES, 875","6,52%",✅ Dentro da média,4.59,Etanol
POSTO CRUZEIRO,SP,FRANCA,"Rua AV PRES VARGAS 624, S/N","6,52%",✅ Dentro da média,4.59,Etanol
POSTO DE SERVICO S S LTDA,SP,SAO PAULO,"Rua R.  ARTUR DE AZEVEDO 696, S/","6,52%",✅ Dentro da média,4.59,Etanol
POSTO DE SERVICOS,SP,SAO PAULO,"Rua R BIXIRA 234, S/N","6,52%",✅ Dentro da média,4.59,Etanol
POSTO MARIO ROBERTO,SP,FRANCA,Rua AV. DR ANTONIO BARBOSA FILHO,"6,52%",✅ Dentro da média,4.59,Etanol
POSTO RETA DA PRAIA,ES,VILA VELHA,"Rua AV STA LEOPOLDINA 1650, S/N","6,52%",✅ Dentro da média,4.59,Etanol
POSTO SHOPPING MOGI LTDA,SP,MOGI DAS CRUZES,Rua AVENIDA VER NARCISO YAGUE GU,"6,52%",✅ Dentro da média,4.59,Etanol
POSTOS ALPA-SHELL,MG,ARAXA,"Rua AV MINISTRO OLAVO DRUOM 500,","6,52%",✅ Dentro da média,4.59,Etanol
AUTO POSTO DORNELAS,MG,MURIAE,"Rua PC DORNELAS 85, S/N","6,52%",✅ Dentro da média,4.589999999999999,Etanol
AUTO POSTO XIXOVA,SP,PRAIA GRANDE,AVENIDA AYRTON SENNA DA SIL 500,"6,52%",✅ Dentro da média,4.589999999999999,Etanol
POSTO DIVISA POSTO DIVI,RJ,JAMAPARA,"Rua R PAULINO FERNANDES 21 D, S/","6,52%",✅ Dentro da média,4.589999999999999,Etanol
POSTO LIMA,CE,TAMBORIL,"Rua R FRANKLIN CAVALCANTE 1007,","6,48%",✅ Dentro da média,6.620000000000001,Gasolina Comum
POSTO 3D,MG,ALEM PARAIBA,Área R CORONEL CASTELO BRANCO 16,"6,48%",✅ Dentro da média,6.62,Gasolina Comum
PORTAL TUDE BASTOS,SP,PRAIA GRANDE,"Rua AV.  TRABALHADOR 907, S/N","6,45%",✅ Dentro da média,4.587100188704087,Etanol
ALESAT POSTO MARANATA,MA,BURITICUPU,"Rua ESTR BR 222 KM 160  851, S/N","6,40%",✅ Dentro da média,6.6155376972530675,Gasolina Comum
LEAL COMERCIO DE PETROLEO LTDA,CE,FORTALEZA,"Rua AVENIDA PRES COSTA E SILVA,","6,40%",✅ Dentro da média,6.615412216759903,Gasolina Comum
POSEIDON AUTO POSTO LTDA,SP,MONGAGUA,"Rua AV TIRADENTES 6797, S/N","6,36%",✅ Dentro da média,4.583136697741126,Etanol
POSTO DOIS IRMAOS,CE,BARBALHA,"Rua AV COSTA CAVALCANTI 1075, S/","6,34%",✅ Dentro da média,6.250000000000001,Diesel S10
POSTO APM,PE,PAULISTA,"Rua AV SEN SALGADO FILHO 18, S/N","6,32%",✅ Dentro da média,6.609999999999999,Gasolina Comum
RECANTO OIL AUTO POSTO,DF,BRASILIA,"Rua QUADRA    LOTE 1 304, S/N","6,28%",✅ Dentro da média,4.58,Etanol
POSTO MARIO ROBERTO JANJAO,SP,FRANCA,"Avenida DOUTOR HELIO PALERMO, 38","6,27%",✅ Dentro da média,4.579292416941415,Etanol
POSTO  SAO DOMINGOS MO,CE,FORTALEZA,Rua AVENIDA  OLIVEIRA PAIVA 1414,"6,23%",✅ Dentro da média,6.604597022813353,Gasolina Comum
AUTO POSTO CIDADAO LTDA,SP,FRANCA,"Avenida BRASIL, 2300","6,22%",✅ Dentro da média,4.577096024235021,Etanol
POSTO CAMARADA,CE,MARACANAU,Área ROD SENADOR ALMIR PINTO CE,"6,19%",✅ Dentro da média,6.602518038852914,Gasolina Comum
COMERCIO DE COMBUSTIVEIS PETROSO,MA,BALSAS,"Rua AV DR JOSE BERNARDINO, 130,","6,19%",✅ Dentro da média,6.602321389154591,Gasolina Comum
POSTO IMBOASSICA COMERCIO E SER,RJ,MACAE,"Rua ROD AMARAL PEIXOTO KM 164,7,","6,18%",✅ Dentro da média,6.601887921241953,Gasolina Comum
BELO PETRO,PE,BELO JARDIM,RODOVIA BR232 185,"6,17%",✅ Dentro da média,6.24,Diesel S10
POSTO SERRANO,SE,ARACAJU,Área AV CHANCELER OSVALDO ARANHA,"6,16%",✅ Dentro da média,6.600465917564476,Gasolina Comum
AUTO POSTO SERRANO,RN,PATU,Rua R MARIA HENRIQUE GODEIRO DA,"6,15%",✅ Dentro da média,6.6,Gasolina Comum
POSTO MAIS BALSAS LTDA,MA,BALSAS,"Rodovia ROD RODOVIA BR, NA","6,15%",✅ Dentro da média,6.6,Gasolina Comum
POSTO SORRISO,SE,CAPELA,"Rua ROD BR 101, KM 36, S/N","6,15%",✅ Dentro da média,6.6,Gasolina Comum
TRUCK CENTER,CE,PECEM,"Área RODOVIA CE 155, 0000, S/N","6,15%",✅ Dentro da média,6.6,Gasolina Comum
POSTO PADRE CICERO,CE,TRAIRI,"Rua AV SEN VIRGILIO TAVORA, S/N","6,09%",✅ Dentro da média,6.596137655657824,Gasolina Comum
POSTO CEMOPEL 3,PE,OLINDA,"Rua AV DR JOAQUIM NABUCO 1600, S","6,07%",✅ Dentro da média,6.595022511255627,Gasolina Comum
TRAVESSIA FULL SERVICE,SP,FRANCA,"Rua AV REYNALDO CHIOCA 2000, S/N","6,05%",✅ Dentro da média,4.57,Etanol
POSTO PAINEIRAO,SP,FRANCA,"Rua R BENEDITO MERLINO 930, S/N","6,05%",✅ Dentro da média,4.569999999999999,Etanol
POSTO SANTA MARIA,MA,BOM JESUS DAS SELVAS,"Rua BR 222 KM 100, S/N","6,02%",✅ Dentro da média,6.591480179529833,Gasolina Comum
POSTO CANCELA-SHELL,RJ,MACAE,"Rua EST DA CANCELA PRETA,60, S/N","6,01%",✅ Dentro da média,6.591097455985537,Gasolina Comum
QS COMBUSTIVEIS,CE,EUSEBIO,"Avenida EUSEBIO DE QUEIROZ, 2651","6,00%",✅ Dentro da média,6.590301059477604,Gasolina Comum
AUTO POSTO BASTOS,CE,ICO,"Área PADRE JOSE ALVES DE MACEDO,","5,99%",✅ Dentro da média,6.590000000000001,Gasolina Comum
AUTO POSTO M VIRGEM,SP,RIBEIRAO PIRES,"Rua AV FRANCISCO MONTEIRO 1396,","5,99%",✅ Dentro da média,6.590000000000001,Gasolina Comum
D F SOUZA FILHO LTDA,RJ,SAPUCAIA,"Rua R RAFAEL LANGONI 105, S/N","5,99%",✅ Dentro da média,6.590000000000001,Gasolina Comum
FACIL COMERCIO DE COMBUSTIVEIS,CE,QUIXADA,"Avenida PLACIDO CASTELO, 1519","5,99%",✅ Dentro da média,6.590000000000001,Gasolina Comum
POSTO XALE,RJ,BARRA DO PIRAI,"Rua ROD LUCIO MEIRA BR 393, S/N","5,99%",✅ Dentro da média,6.590000000000001,Gasolina Comum
AUTO POSTO ALDEIA DA PRAIA LTDA,ES,GUARAPARI,"Rua AVENIDA PARIS, 00, S/N","5,99%",✅ Dentro da média,6.59,Gasolina Comum
POSTO ANCHIETA,ES,ANCHIETA,"Rua ROD SOL 19755, S/N","5,99%",✅ Dentro da média,6.59,Gasolina Comum
POSTO BEIRA RIO,CE,CRATEUS,"Rua AV SRG HERMINIO 500, S/N","5,99%",✅ Dentro da média,6.59,Gasolina Comum
POSTO LIDER 5,RJ,CAMPOS DOS GOYTACAZES,"Rua AV MARIO MANHAES DE ANDRADE,","5,99%",✅ Dentro da média,6.59,Gasolina Comum
POSTO RODOVIARIA,ES,VITORIA,"Avenida NAIR AZEVEDO SILVA, 430","5,99%",✅ Dentro da média,6.59,Gasolina Comum
POSTO SAO CRISTOVAM,RN,MACAIBA,"Rua AT DO FERREIRO PORTO SN, S/N","5,99%",✅ Dentro da média,6.59,Gasolina Comum
POSTO SAO CRISTOVAO,MA,BALSAS,"Rua ROD BR 230 SN, S/N","5,99%",✅ Dentro da média,6.59,Gasolina Comum
SHOP CAR 5,MA,IMPERATRIZ,"Rua AVENIDA DORGIVAL PINHEIRO ,","5,99%",✅ Dentro da média,6.59,Gasolina Comum
POSTO SAO DOMINGOS SINHA SABOIA,CE,SOBRAL,Rua AV. SEN FERNANDES TAVORA 133,"5,99%",✅ Dentro da média,6.589999999999999,Gasolina Comum
COM.VAREJ.OUTROS COMBUSTI.LUBRIF,RJ,MACAE,Rua AV. PREFEITO ARISTEU FERREIR,"5,99%",✅ Dentro da média,6.589641354881557,Gasolina Comum
POSTO CENTRAL DE CORDEIRO LTDA,RJ,CORDEIRO,"Rua R. CEL. JOSE OLIMPIO CARVAL,","5,98%",✅ Dentro da média,6.589448915959685,Gasolina Comum
POSTO WALTAR,RJ,CORDEIRO,"Rua R WALTER FERREIRA TARDIN 65,","5,98%",✅ Dentro da média,6.589116883116882,Gasolina Comum
POSTO PIRAMIDE,RJ,MIRACEMA,Rua R JOAO PESSOA 196 PROX MARCE,"5,98%",✅ Dentro da média,6.588893422714466,Gasolina Comum
REDE CEARA OUTLET,CE,CAUCAIA,"Área ROD. BR 020, KM 14,5, 6354,","5,95%",✅ Dentro da média,6.587432831970797,Gasolina Comum
POSTO ITAPERY,CE,FORTALEZA,"Rua AV. PRES COSTA E SILVA 2721,","5,88%",✅ Dentro da média,6.293772763262075,Diesel
POSTO PRADO,RJ,NOVA FRIBURGO,"Área AVENIDA GOV ROBERTO SILVEI,","5,87%",✅ Dentro da média,6.582064198983236,Gasolina Comum
POSTO ARMACAO DE BUZIOS,RJ,ARMACAO DOS BUZIOS,Rua AVENIDA JOSE B RIBEIRO DANTA,"5,85%",✅ Dentro da média,6.581350293542076,Gasolina Comum
POSTO ITAPERY,CE,FORTALEZA,"Rua AV. PRES COSTA E SILVA 2721,","5,84%",✅ Dentro da média,6.580686355843151,Gasolina Comum
POSTO CJCM,PE,RECIFE,"Rua ERNESTO DE PAULA SANTOS, 525","5,83%",✅ Dentro da média,6.58,Gasolina Comum
AUTO POSTO UNAMAR,RJ,CABO FRIO,"Rua RODOVIA AMARAL PEIXOTO  SN,","5,82%",✅ Dentro da média,6.29,Diesel
POSTO CAMPO VERDE,SP,MAUA,"Avenida BARAO DE MAUA, 2204","5,82%",✅ Dentro da média,6.289999999999999,Diesel
POSTO MONSENHOR TABOSA,CE,FORTALEZA,"Rua AV MONSENHOR TABOSA, S/N","5,72%",✅ Dentro da média,6.57297526262284,Gasolina Comum
STYLLUS,RJ,PATY DO ALFERES,Área AV OSORIO DUQUE ESTRADA 583,"5,69%",✅ Dentro da média,6.571103744974963,Gasolina Comum
AUTO POSTO DOIS IRMAOS,CE,NOVA OLINDA,"Rua SITO JACUZ CE 292 SN, S/N","5,68%",✅ Dentro da média,6.28172807424594,Diesel
POSTO SERVICAR 2,PE,OLINDA,"Rua AV OLINDA 150, S/N","5,67%",✅ Dentro da média,6.570000000000001,Gasolina Comum
POSTO NOVO BUZIOS,RJ,ARMACAO DOS BUZIOS,"Rua R. JOSE BENTO R DANTAS 5587,","5,67%",✅ Dentro da média,6.57,Gasolina Comum
POSTO RASA,RJ,ARMACAO DOS BUZIOS,Área AV JOSE BENTO RIBEIRO DANTA,"5,67%",✅ Dentro da média,6.57,Gasolina Comum
POSTO SERVCAR,PE,RECIFE,"Rua AV MANOEL BORBA 410, S/N","5,67%",✅ Dentro da média,6.569999999999999,Gasolina Comum
POSTO PORTAL DA ILHA,SP,ILHABELA,"Rua AV PRINCESA ISABEL, S/N","5,67%",✅ Dentro da média,4.553559593800107,Etanol
POSTO VIANENSE,MA,VIANA,"Rodovia MA 014/3, S/N","5,67%",✅ Dentro da média,6.569655675899494,Gasolina Comum
POSTO GIPAGEL II,PB,PATOS,"Rua CARREIROS, 3","5,67%",✅ Dentro da média,6.281133898851069,Diesel
AUTOPOSTO AGUA BRANCA,PI,AGUA BRANCA,"Avenida JOSE MIGUEL, 1557","5,65%",✅ Dentro da média,6.28,Diesel
POSTO BOAVENTURA,CE,FORTALEZA,"Rua AV.  GODOFREDO MACIEL, 6060,","5,61%",✅ Dentro da média,6.566361264674822,Gasolina Comum
POSTO CAPEBE COQUERAL,MG,COQUEIRAL,Rua AV PRESINTE AURELIANO CHEV 3,"5,59%",✅ Dentro da média,4.550000000000001,Etanol
AUTO POSTO DF 180,GO,AGUAS LINDAS DE GOIAS,Área QUADRA 8 SN LT 16 17 E 18 S,"5,59%",✅ Dentro da média,4.55,Etanol
POSTO CAPEBE ILCINEA,MG,ILICINEA,"Avenida 15 DE NOVEMBRO, 1057","5,59%",✅ Dentro da média,4.55,Etanol
SERVICAR SA,PE,JABOATAO DOS GUARARAPES,"Rua AV.  ARMINDO MOURA,461, S/N","5,54%",✅ Dentro da média,6.5617160191122865,Gasolina Comum
POSTO INDEPENDENTE,CE,BREJO SANTO,"Rua R JOSE MATIAS SAMPAIO 750, S","5,51%",✅ Dentro da média,6.56,Gasolina Comum
POSTO MARLIN,ES,SERRA,"Rua ROD.ES 010 KM 09, S/N","5,50%",✅ Dentro da média,6.559209113336236,Gasolina Comum
POSTO SANTO ANTONIO,MG,COROMANDEL,Rua R CLESIO EUSTAQUIO MIGUELETO,"5,49%",✅ Dentro da média,6.2,Diesel S10
POSTO UMARITUBA HORIZONTE,CE,HORIZONTE,Rua AV PRESID CASTELO BRANCO 867,"5,49%",✅ Dentro da média,6.558476293282404,Gasolina Comum
POSTO SUL-SHELL,CE,FORTALEZA,"Rua ROD.  BR-116 KM 07 N 2620, S","5,41%",✅ Dentro da média,6.553421972344629,Gasolina Comum
AUTO POSTO VIAGAS,PE,RECIFE,"Área AV.  RECIFE 2586, S/N","5,35%",✅ Dentro da média,6.55,Gasolina Comum
PETROCAL BOA VIAGEM,PE,RECIFE,"Rua R ERNESTO DE PAULA STOS 465,","5,35%",✅ Dentro da média,6.55,Gasolina Comum
POSTO ATLANTIDA,PE,PAULISTA,R 24,"5,35%",✅ Dentro da média,6.55,Gasolina Comum
POSTO SAO JANUARIO LTDA,PE,OLINDA,"Rua AV OLINDA 514, S/N","5,35%",✅ Dentro da média,6.55,Gasolina Comum
VENDA GRANDE,PE,RECIFE,Área AV ENGENHEIRO ABDIAS DE CAR,"5,35%",✅ Dentro da média,6.549999999999999,Gasolina Comum
POSTO BRAGA,CE,MOMBACA,"Rua R JOSE DE SA AZEVEDO, 99, S/","5,32%",✅ Dentro da média,6.19,Diesel S10
POSTO BRASIL-SHELL,CE,SOBRAL,"Rua AV.  BR-222 KM 221, S/N","5,32%",✅ Dentro da média,6.19,Diesel S10
POSTO CACIQUE,PI,AGUA BRANCA,"Área RODOVIA BR 343 805-A, S/N","5,32%",✅ Dentro da média,6.19,Diesel S10
POSTO CORRENTINA,BA,CORRENTINA,"Rua ROD BR 349 KM 46, 46, S/N","5,32%",✅ Dentro da média,6.19,Diesel S10
POSTO GAVIAO,CE,FORTALEZA,"Rua AV.  BEZERRA DE MENEZES 161,","5,32%",✅ Dentro da média,6.19,Diesel S10
POSTO MARACAJA,PE,SURUBIM,"Rua ROD PE 90 KM 63,3, S/N","5,32%",✅ Dentro da média,6.19,Diesel S10
POSTO NOVA OLINDA,TO,NOVA OLINDA,"Rua AV.BERNARDO SAYAO 861, S/N","5,32%",✅ Dentro da média,6.19,Diesel S10
QS COMBUSTIVEIS,CE,EUSEBIO,"Avenida EUSEBIO DE QUEIROZ, 2651","5,32%",✅ Dentro da média,6.19,Diesel S10
TAMARA GOMES UCHOA DE AMORIM,CE,IGUATU,"Avenida CARLOS ROBERTO COSTA, 17","5,32%",✅ Dentro da média,6.19,Diesel S10
POSTO ANEL VIARIO,CE,JUAZEIRO DO NORTE,"Avenida DO AGRICULTOR, 1575","5,31%",✅ Dentro da média,6.547236260265321,Gasolina Comum
MM PETROLEO,CE,MARACANAU,"Avenida RADIALISTA JOAO RAMOS, 3","5,28%",✅ Dentro da média,6.545526970450821,Gasolina Comum
POSTO 3D JAMAPARA,RJ,JAMAPARA,"Rua AV  COTRIL, S/N","5,28%",✅ Dentro da média,5.790000000000001,Diesel S50
POSTO CATATAU,CE,TIANGUA,"Rua BR 222 KM 314, S/N","5,27%",✅ Dentro da média,6.544955403683541,Gasolina Comum
AUTO POSTO CIDADAO LTDA,SP,FRANCA,"Avenida BRASIL, 2300","5,27%",✅ Dentro da média,6.544824561403508,Gasolina Comum
POSTO AMIGAO DE MURIAE,MG,MURIAE,"Rua RODOVIA  BR-116, S/N","5,19%",✅ Dentro da média,6.54,Gasolina Comum
POSTO DON INACIO-BANDEIRA BRANCA,MG,GUAXUPE,AV DONA FLORIANA 1709,"5,15%",✅ Dentro da média,6.18,Diesel S10
DIAS E ROMA LTDA,CE,FORTALEZA,"Rua AV.  GODOFREDO MACIEL, 6060,","5,15%",✅ Dentro da média,6.537252814116215,Gasolina Comum
POSTO DOIS IRMAOS,CE,BARBALHA,"Rua AV COSTA CAVALCANTI 1075, S/","5,14%",✅ Dentro da média,6.25,Diesel
PETROCAL OLINDA,PE,OLINDA,"Rua AV. DR JOAQUIM NABUCO 2445,","5,14%",✅ Dentro da média,6.536690083761146,Gasolina Comum
POSTO APM,PE,OLINDA,"Rua R MONTEIRO LOBATO 32, S/N","5,13%",✅ Dentro da média,6.536329917032699,Gasolina Comum
JET POSTO,SP,FRANCA,"Área AVENIDA AV D PEDRO I 1295,","5,12%",✅ Dentro da média,4.53,Etanol
POSTO JUNQUEIRA,SP,RIBEIRAO PRETO,"Rua RUA OLAVO BILAC, N 20, S/N","5,12%",✅ Dentro da média,4.53,Etanol
AUTO POSTO ROCHA,DF,BRASILIA,"Rua QN 502 CJ 21 LT 1/2, S/N","5,09%",✅ Dentro da média,6.534065934065934,Gasolina Comum
POSTO PERIMETRAL,PE,PAULISTA,"Rua RUA CANOAS, S/N","5,03%",✅ Dentro da média,6.530000000000001,Gasolina Comum
POSTO PG JOSE RUFINO,PE,RECIFE,"Área AV DOUTOR JOSE RUFINO, 3100","5,03%",✅ Dentro da média,6.530000000000001,Gasolina Comum
AUTO POSTO TIGRAO,CE,FORTALEZA,"Rua BR 116 KM 12    2928, S/N","5,03%",✅ Dentro da média,6.53,Gasolina Comum
POSTO SAO JOAO POR DO SOL,CE,FORTALEZA,"Rua AV BARAO DE AQUIRAZ 2530, S/","5,01%",✅ Dentro da média,6.52885601097059,Gasolina Comum
AUTO POSTO N2,MA,BURITICUPU,"Rua ROD BR 222 KM 166 SAGRIMA, S","4,98%",✅ Dentro da média,6.526888650676673,Gasolina Comum
AUTO POSTO CITY PETROP,SP,FRANCA,Rua AV.  RICARTE SOARES SILVA 13,"4,97%",✅ Dentro da média,4.523318580074066,Etanol
ECO VIP COMERCIO DE CO,PE,RECIFE,"Área AV DA RECUPERACAO 5774, S/N","4,93%",✅ Dentro da média,6.523829515611323,Gasolina Comum
POSTO APM 3,PE,OLINDA,Rua AV.GOV CARLOS  L CAVALCANTE,"4,93%",✅ Dentro da média,6.523762949011167,Gasolina Comum
POSTO WAFAROGA,RJ,CAMPOS DOS GOYTACAZES,"Rua MESSIAS URBANO DOS SANTOS, 5","4,92%",✅ Dentro da média,6.523092426710098,Gasolina Comum
CENTRO AUT NOVO BARAO,SP,MAUA,"Avenida BARAO DE MAUA, 2855","4,89%",✅ Dentro da média,4.520093143991449,Etanol
AUTO POSTO ROTA 22,ES,GUARAPARI,AV PE JOSE DE ANCHIET 2083,"4,89%",✅ Dentro da média,6.521239272227944,Gasolina Comum
POSTO JALISCO,RJ,BARRA DO PIRAI,"Rua R ANGELICA 127, S/N","4,88%",✅ Dentro da média,6.520906601583428,Gasolina Comum
VIP POSTOS E SERVICOS,PE,PAULISTA,Rua AV PREFEITO JOSE EUSTAQUIO D,"4,88%",✅ Dentro da média,6.5206036305314585,Gasolina Comum
POSTO 2000,CE,CEDRO,"Rua R DR. GUEDES MARTINS  520, S","4,88%",✅ Dentro da média,6.520512048192772,Gasolina Comum
AUTOPOSTO DE COMBUSTIVEIS BOM DE,PB,RIACHAO DO POCO,"Rua BR 230 KM 77, S/N","4,87%",✅ Dentro da média,6.52,Gasolina Comum
POSTO SAO BENTO,PE,PAULISTA,"Área AVENIDA DR CLAUDIO JOSE GU,","4,86%",✅ Dentro da média,6.519583900408291,Gasolina Comum
POSTO ALTO DO TENENTE,CE,VARZEA ALEGRE,"Área R ANTONIO ALVES DE LIMA, S/","4,85%",✅ Dentro da média,6.5188357529177345,Gasolina Comum
POSTO SAO JOAO,CE,EUSEBIO,"Rua ROD CE040  QLM05 SN, S/N","4,83%",✅ Dentro da média,6.51779874504014,Gasolina Comum
POSTO SAO DOMINGOS CORACAO,CE,SOBRAL,"Rua AV.  JOSE EUCLIDES FERREIRA,","4,81%",✅ Dentro da média,6.159990458015266,Diesel S10
PONTES & LANDIM COMBUSTIVEIS,CE,CAUCAIA,Rua RODOVIA  ESTRUTURANTE - CE 0,"4,78%",✅ Dentro da média,6.514425287356321,Gasolina Comum
VILA DE GOIANA COMERCIO DE COMB,PE,GOIANA,LARGO DA ALVORADA  N 100,"4,77%",✅ Dentro da média,6.5138415428720355,Gasolina Comum
AUTO POSTO LACERDAO III LTDA,SE,FREI PAULO,"Rua ROD BR 235 KM 73 SN RODOVIA,","4,71%",✅ Dentro da média,6.51,Gasolina Comum
POSTO SOBOM,SE,NOSSA SENHORA DAS DORES,Rua AV PAULO VASCONCELOS 400 CEN,"4,71%",✅ Dentro da média,6.51,Gasolina Comum
POSTO AYRTON SENNA,PE,JABOATAO DOS GUARARAPES,"Avenida AYRTON SENNA DA SILVA, 2","4,70%",✅ Dentro da média,6.509285507665607,Gasolina Comum
PETROSERVICE,PE,RECIFE,"Área AV JOAO DE BARROS, 1179, S/","4,70%",✅ Dentro da média,6.509281799591002,Gasolina Comum
POSTO P DA SILVA,PI,PICOS,Rua AV. SENADOR HELVIDIO NUNES 2,"4,64%",✅ Dentro da média,6.15,Diesel S10
POSTO VEREDAS EXPRESS,MG,MURIAE,"Avenida DONA MARICAS, 50","4,63%",✅ Dentro da média,6.504964216005205,Gasolina Comum
INVESTGAS,PE,RECIFE,Rua AV RECUPERACAO BR 101 KM 57,"4,57%",✅ Dentro da média,6.501782768613465,Gasolina Comum
POSTO LITORAL,CE,CASCAVEL,"Rua ROD CE 40 KM 47,2, S/N","4,57%",✅ Dentro da média,6.501329596689524,Gasolina Comum
ARLINDO FONSECA LINS E,PE,ESCADA,"Rua ROD BR 101 SUL KM 132, S/N","4,55%",✅ Dentro da média,6.5,Gasolina Comum
KG COMBUSTIVEIS,CE,IGUATU,Rua AVENIDA PRESIDENTE EURICO DU,"4,55%",✅ Dentro da média,6.5,Gasolina Comum
POSTO MAGNOLIA,MA,ACAILANDIA,"Rua BR 10 KM 1415, S/N","4,55%",✅ Dentro da média,6.5,Gasolina Comum
POSTO SAO JOAO,MA,SAO JOAO DOS PATOS,"Rua AV PRESIDENTE MEDICI   1740,","4,55%",✅ Dentro da média,6.5,Gasolina Comum
POSTO VALADARES,PI,VALENCA DO PIAUI,"Rua R JOAQUIM MANOEL 644, S/N","4,55%",✅ Dentro da média,6.5,Gasolina Comum
POSTO UNIVERSO,RJ,CAMPOS DOS GOYTACAZES,"Rua AV.  ALBERTO LAMEGO 700, S/N","4,54%",✅ Dentro da média,6.499420166638327,Gasolina Comum
POSTO SANTANA,MA,MATOES,AVENIDA GETULIO VARGAS 23 2398,"4,53%",✅ Dentro da média,6.499249928222796,Gasolina Comum
POSTO MONTEZUMA V,CE,FORTALEZA,"Rua RUA GRACA ARANHA 150, S/N","4,52%",✅ Dentro da média,6.498336355065635,Gasolina Comum
AS ILHAS AUTO POSTO,SP,SAO SEBASTIAO,Área RUA MANOEL MARCELINO DE MAT,"4,47%",✅ Dentro da média,4.501937840589258,Etanol
POSTO CARIOCA,CE,FORTALEZA,"Rua AV.  LUIZ  VIEIRA  835, S/N","4,47%",✅ Dentro da média,6.14,Diesel S10
POSTO SANTO ANDRE LTDA,RJ,CAMPOS DOS GOYTACAZES,"Área AV RAUL SOUTO MAIOR 114, S/","4,46%",✅ Dentro da média,6.494531206197918,Gasolina Comum
PETROBULL,MG,ARAXA,"Rua AV AMAZONAS 308, S/N","4,45%",✅ Dentro da média,4.500921018743739,Etanol
POSTO CATATAU,CE,TIANGUA,Área AVENIDA JOSE EVANGELISTA DE,"4,43%",✅ Dentro da média,6.4926283689591076,Gasolina Comum
POSTO JARANA PARA-SHELL,CE,FORTALEZA,"Rua RUA FRANCISCO MATOS, S/N","4,40%",✅ Dentro da média,6.490922447013489,Gasolina Comum
AUTO POSTO DORNELAS,MG,MURIAE,"Rua PC DORNELAS 85, S/N","4,39%",✅ Dentro da média,6.490000000000001,Gasolina Comum
POSTO JARDIM AMALIA LTDA,RJ,VOLTA REDONDA,"Área AV AMARAL PEIXOTO, 957, S/N","4,39%",✅ Dentro da média,6.490000000000001,Gasolina Comum
POSTO MORADA NOVA 2,CE,MORADA NOVA,"Rua ROD CE 138 KM 64, S/N","4,39%",✅ Dentro da média,6.490000000000001,Gasolina Comum
A P COSTA,RJ,VOLTA REDONDA,"Área RODOVIA LUCIO MEIRA, S/N","4,39%",✅ Dentro da média,6.49,Gasolina Comum
ALIANCA VILA 2000,RJ,VOLTA REDONDA,"Rua R.  VINTE E TRES 08, S/N","4,39%",✅ Dentro da média,6.49,Gasolina Comum
AUTO POSTO ALEX,CE,IGUATU,"Rua RUA JULIO CAVALCANTE, 50, S/","4,39%",✅ Dentro da média,6.49,Gasolina Comum
AUTO POSTO MARCO TIMBOZAO LTDA,RJ,RETIRO DO MURIAE,"Área ROD BR 356, 2005, S/N","4,39%",✅ Dentro da média,6.49,Gasolina Comum
CEMOPEL TORRE 3,PE,RECIFE,Avenida MARECHAL MASCARENHAS DE,"4,39%",✅ Dentro da média,6.49,Gasolina Comum
ORGANIZACAO PATU,CE,BARREIRA,"Rua R FELIX PEREIRA 671, S/N","4,39%",✅ Dentro da média,6.49,Gasolina Comum
POSTO BRISA DE TERESOPOLIS LTDA,RJ,TERESOPOLIS,"Rua RUA MANOEL JOSE LEBRAO, 477,","4,39%",✅ Dentro da média,6.49,Gasolina Comum
